url,site,document,documenttype,postdate,likes,dislike,comment_cnt,views,boardcategory,documentcategory
https://quasarzone.com/groupSearches?keyword=에어팟,퀘이사존,지금 에어팟2세대 사용중입니다!에어팟 프로 vs 에어팟 3 고민중인데 뭐가 나을까요...각자 장단점이 있어서 좀 고민이네요,nan,2022.06.19 21:50,nan,nan,2,336,게이밍오디오 게시판 ,nan
https://quasarzone.com/groupSearches?keyword=에어팟,퀘이사존,에어팟끼고 운동 자주 했는데 오래 썼더니 한쪽이 안 들리기 시작하더니 이제는 아예 알아서 블루투스가 풀려버리네요 ㅠ3세대랑 2세대랑 가격차이나 그런거 많이 날까요?어차피 운동할때만 거의 쓰는거라 요즘은 가격대가 어떻게 하나요?,nan,2022.06.21 00:14,nan,nan,3,226,자유게시판 ,nan
https://quasarzone.com/groupSearches?keyword=에어팟,퀘이사존,써글!!!!!!!!!!!!!!!!!!!!!!!!!!아아ㅏ아앙ㅇ어ㅏ라ㅏ아ㅏ아아으아아아어어아ㅏ아아악!!!!!!!!!!!!!!!!!하….짜증나네요.뭘 쉽게 안잃어버리는데 가아끔 잃어버리면 꼭 비싼걸 잃어버립니다.. 출근한다고 쟈철에서 잠깐 잠들었다 깨자마자 호다닥 내렸는데 내리고 보니 주머니에 케이스가 없는 매직…지하철 유실물센터에도 전화해보고 경찰청 분실물 홈페이지 들어가봐도 없네요.. 으악..ㅠ6월 15일 오전 여섯시 사십분쯤 방화행 5호선 열차 안에서 잃어버렸습니다.. 내리긴 신길에서 내렸습니다..보라색 반투명 케이스 씌워진 에어팟 프로 본체 줏으신 분 혹시 계시면 사례하겟습니다..,nan,2022.06.20 23:52,nan,nan,3,373,자유게시판 ,nan
https://quasarzone.com/groupSearches?keyword=에어팟,퀘이사존,"해외 매체의 기사를 번역한 것으로 오역과 의역이 있을 수 있으며 자세한 내용은 원문을 참고하시기 바랍니다.[루머] 에어팟 프로 2, 심박수 모니터링, 보청기 기능 탑재
애플의 AirPods Pro 2가 곧 출시될 예정이며 오늘 새로운 유출로 인해 많은 렌더와 함께 이에 대한 몇 가지 세부 정보가 제공됩니다.
AirPods Pro 2에는 적응형 액티브 노이즈 캔슬링을 지원하는 새로운 H1 칩용 SiP(System-in-Package)가 함께 제공됩니다. 새로운 SiP는 ""고집적도 및 더 나은 제조 기술""로 인해 더 나은 성능과 개선된 전력 소비를 제공합니다.또한 개선된 나의 찾기 기능과 심박수 모니터링 및 보청기 사용 모드와 같은 새로운 기능이 있습니다. 이 케이스는 USB-C 포트와 함께 제공되며 최적화된 고속 충전을 제공합니다.
보시다시피 외형은 AirPods Pro와 유사하며 AirPods 3도 마찬가지입니다. 이들은 분명히 같은 제품군에 속합니다. AirPods Pro 2의 줄기에는 이전 세대와 동일한 압력 감지 버튼이 있습니다.
AirPods Pro 2는 심박수 센서를 사용하여 온도를 모니터링할 수도 있지만 실제로 온도 모니터링을 사용할 수 있는지 여부는 확실하지 않습니다.
보청기 기능은 마이크가 있는 새로운 케이스와 함께 작동하며 소리 향상을 위해 들은 것을 이어폰으로 전송할 수 있습니다. 케이스 안에 스피커가 있어 나의 찾기 기능을 활성화하면 소리를 재생할 수 있어 케이스를 더 쉽게 찾을 수 있습니다.오디오 측면에서 우리는 자동 적응형 EQ, 헤드 트래킹을 위한 공간 오디오 및 오디오 공유와 함께 맞춤형 고진폭 드라이브 장치와 높은 다이내믹 레인지 앰프의 조합을 분명히 기대할 수 있습니다.






",nan,2022.06.25 11:47,nan,nan,17,2742,모바일 뉴스 ,nan
https://quasarzone.com/groupSearches?keyword=에어팟,퀘이사존,애플티비 구매 고려중인데 애플티비 기능중에 티비의 사운드를 애플티비로 받아서 출력이 가능하다고 하더라고요 그러면 플스 연결된 티비에 애플티비 연결후 애플티비에 에어팟 맥스 연결하면 플스 소리를 에어팟맥스로 들을수 있는걸까요?,nan,2022.06.27 04:48,nan,nan,2,463,게이밍오디오 게시판 ,nan
https://quasarzone.com/groupSearches?keyword=에어팟,퀘이사존,"제목에서 처럼 b550m 와이파이 메인보드에 에어팟 프로를 물려서 배틀그라운드 용으로 사용중입니다.여태껏 모르고있다가 이번에 처음으로 이지투디제이를 하는데 사운드가 딜레이가 있었더군요 ;;배틀그라운드 특성상 사운드를 조금이라도 빨리 들어야하는데 이 딜레이를 좀 빠르게 당길 수  있을까요 ??에어팟 프로, 550m 박격포 와이파이 보드 둘 다 딜레이가 생길만큼 나쁜 제품이라고는 생각되지 않습니다 ...형님들의 도움이 필요합니다",nan,2022.06.23 00:23,nan,nan,1,227,게이밍오디오 게시판 ,nan
https://quasarzone.com/groupSearches?keyword=에어팟,퀘이사존,노캔 사용하면 거의 안들리는 수준인데 왼쪽 유닛만 고속도로 소리같은 게 흘러들어옵니다.스테레오 공간화는 고정되어있습니다.,nan,2022.07.03 02:53,nan,nan,0,117,게이밍오디오 게시판 ,nan
https://quasarzone.com/groupSearches?keyword=에어팟,퀘이사존,"3개 이상 담으시면 할인전 가격이 30,000원 넘어서 배송비 무료 입니다.몇개 없으니 언능 가져 가세요링크 타시고 낮은 가격순 누르세요에어팟 프로인지 1세대 인지 잘 보고 사세요 저 5개 샀는데 1개 모르고 1세대꺼 샀네요",nan,2022.07.13 16:34,nan,nan,10,5458,핫딜 게시판 ,nan
https://quasarzone.com/groupSearches?keyword=에어팟,퀘이사존,"에어팟 프로 케이스 튼튼해보여서 사려고 했는데 최저가네요.
블랙 색상도 동일한 가격입니다.
로켓배송 상품 함께 구매해야 무료배송입니다.",nan,2022.06.24 17:18,nan,nan,8,7279,핫딜 게시판 ,nan
https://quasarzone.com/groupSearches?keyword=에어팟,퀘이사존,"저는 예전부터 아이폰만쓰다가 금년 2월에 z플립3로 바꾼 사용자입니다.이전  부터 아이폰만 쓰다보니 3년정도 쓴 에어팟프로가 있는데아직도 기능적으로 쌩쌩하긴한데오래쓰다보니 배터리도 금방 광탈되고(하루에 한번은 완충해야 다음날 지장이 없는..)갤럭시 쓰다보니 에어팟에 현재 배터리 량도 확인 불가, 세부적인 이퀄라이저 변경이나(거의 안하겠지만..) 노이즈캔슬링 변경이 맘처럼 쉽게 되진 않는것은 알고계실겁니다.물론 서드파티 앱으로 변경이 가능하다곤 하지만 제조사에서 제공한 앱이 아니다보니UI나 광고가 많아 불편함이 많은데요,사실 계획은 사용하고있는 에어팟프로를 처분하고 버즈프로나 버즈2를 구매할까 했으나에어팟프로 중고가격이 그렇게 비싸진 않더군요.. 더구나나 오래써서 팔기엔 애매하구요.이참에 버즈2나 프로를 살까 고민중인데 10만원의 가치가 있을까요? ",nan,2022.07.18 09:24,nan,nan,1,305,모바일/스마트폰 게시판 ,nan
https://quasarzone.com/groupSearches?keyword=에어팟,퀘이사존,"해외 뉴스 기반으로 오역 및 의역이 있을 수 있습니다. 참고 부탁드립니다.Apple의 AirPods Pro 2는 올해 말에 출시될 예정이며 몇 달 뒤에 iPhone 14가 공개됨에 따라 그 행사에서 2세대 무선 이어버드가 발표되는 것을 볼 수 있었습니다. 정보 제공자에 따르면 잠재적인 AirPods Pro 소유자는 최신 모델로 업그레이드할 핑계가 있지만 iPhone 11 이상과 같은 필수 하드웨어가 없으면 전체 기능 제품군에 액세스하지 못할 수 있습니다.
iPhone 11 및 이후 모델에는 AirPods Pro 2에 속한 독점 기능에 액세스하는 데 사용할 수 있는 칩인 Apple의 U1이 탑재되어 있습니다.
AirPods Pro 2는 무손실 오디오 지원과 함께 향상된 칩과 함께 제공될 것으로 예상됩니다. Twitter의 ShrimpApplePro에 따르면 '호환성'은 iPhone 11 이상, 일부 iPad 모델 및 Apple Silicon Mac이 있는지 여부에 따라 다릅니다. 이 트윗은 일부 잠재 구매자를 혼란스럽게 할 수 있지만, 다른 Apple 제품을 소유하지 않고 AirPod를 구매하는 수백만 명의 고객이 잠재적으로 있기 때문에 앞서 언급한 하드웨어가 없는 경우 Apple은 AirPods Pro 2를 사용할 수 없도록 만들지 않을 것입니다.대신 Apple은 올바른 장치가 페어링되지 않는 한 AirPods Pro 2의 일부 기능을 제한할 수 있습니다. iPhone 11은 M1 모델부터 시작하는 Apple Silicon Mac과 함께 Apple에서 U1 칩을 탑재한 첫 번째 제품이라는 점을 감안할 때 해당 칩의 존재는 AirPods Pro 2의 독점 기능을 가능하게 할 수 있습니다. 이러한 기능에는 완전히 새로운 청취 경험을 제공하는 Lossless Audio, 휴대 케이스가 잘못 배치되거나 도난당한 경우 고급 추적이 포함될 수 있습니다.슬프게도 AirPods Pro 2에는 건강 관련 기능이 내장되어 있지 않지만 향후 반복에서 도입될 추가 기능입니다. 곧 출시될 무선 이어버드와 페어링하는 장치에 관계없이 향상된 활성 소음 제거와 배터리 수명 연장이 있을 수 있다.
뉴스 출처: ShrimpApplePro




",nan,2022.07.19 09:32,nan,nan,11,5408,모바일 뉴스 ,nan
https://quasarzone.com/groupSearches?keyword=에어팟,퀘이사존,"와우회원 카드할인시 176,900원 입니다.기본할인 14% > 17%
와우 카드할인 13% > 10%
으로 변경되어 176,400원 입니다.환율 대비 가격이 좋아보입니다.
프로가 아닌 3세대이고 오픈형 입니다.


",nan,2022.07.20 20:52,nan,nan,32,9776,핫딜 게시판 ,nan
https://quasarzone.com/groupSearches?keyword=에어팟,퀘이사존,skpay 신한카드 할인 17% 먹이면 중고장터 미개봉 금액정도에 구매가능하네요저는 어머니께서 에어팟 2세대 콩나물 두쪽 다 잃어버리셔서 선물사드릴겸 하나 구매했습니다,nan,2022.07.20 19:13,nan,nan,7,4085,핫딜 게시판 ,nan
https://quasarzone.com/groupSearches?keyword=에어팟,퀘이사존,분명 가로 길이가 더 긴 에어팟 프로 케이스로 보여서 3개 질렀더니 셋다 에어팟 2 케이스네요 ㅜㅜ썸네일이랑 내용물이랑 다른것 무엇..이참에 에어팟 오픈형을 사야되는건지,nan,2022.07.14 16:15,nan,nan,0,337,자유게시판 ,nan
https://quasarzone.com/groupSearches?keyword=에어팟,퀘이사존,군포시 이마트 산본점 매장  픽업입니다.,nan,2022.08.08 14:10,nan,nan,14,6573,핫딜 게시판 ,nan
https://quasarzone.com/groupSearches?keyword=에어팟,퀘이사존,"번역기로 인한 오역이 있을 수 있습니다.


	



	


AirPods는 도시의 위험으로부터 당신을 보호합니다.



Apple의 헤드폰인 AirPods는 언젠가 환경에서 감지된 위험에 따라 볼륨을 자동으로 조정할 수 있습니다.






	


70년대 말 최초의 Walkman이 등장한 이후로 음악은 어디에서나 우리를 따라다녔지만 어리석고 치명적인 사고를 일으키기도 했습니다. 

귀에 들리는 소리는 우리가 환경에 대해 덜 인식하게 만드는 경향이 있습니다. 소음 제거 기술의 경우 더욱 그렇습니다.



주변 도시 위험을 감지하는 스마트 에어팟

어리석게도 차에 치이는 것을 방지하기 위해 Apple은 최근 외부 소음부터 시작하여 다양한 요인에 따라 AirPod의 소리를 자동으로 조정하는 기술에 대한 특허를 취득했습니다. 


	


지금까지는 그다지 특별한 것이 없었지만 시스템은 연결된 iPhone 또는 Apple Watch의 GPS 데이터를 제공하여 혼잡한 교차로나 작업 구역을 감지할 수도 있습니다.



잠재적으로 위험한 영역의 위치에 따라 오른쪽 또는 왼쪽 귀의 볼륨 레벨을 조정하기 위해 사용자의 방향도 고려할 수 있습니다.


	
",nan,2022.07.26 09:52,nan,nan,38,3622,하드웨어 뉴스 ,nan
https://quasarzone.com/groupSearches?keyword=에어팟,퀘이사존,"해외 매체 기사를 단순 번역한 것으로 자세한 내용은 원문을 참고하시기 바랍니다.[루머] 에어팟 프로2는 라이트닝 충전 케이스, 2023년에 USB-C 충전케이스 출시 예정분석가 Ming-Chi Kuo에 따르면 애플의 2세대 에어팟 프로에는 여전히 라이트닝 충전 케이스가 있을 수 있습니다. 오늘 트윗에서 Kuo는 애플이 2023년에 모든 에어팟 모델에 대해 USB-C 충전 케이스로 전환할 것이라고 예측했습니다.Kuo는 새로운 에어팟 프로가 올해 말에 출시될 것이라고 말했습니다. 액티브 노이즈 캔슬링과 같은 기능을 제공하는 H1 칩으로의 업그레이드를 포함하여 Apple Lossless 오디오 재생 지원, 확장된 피트니스 추적 기능을 위한 업데이트된 모션 센서, 분실 시 소리를 낼 수 있는 새로운 충전 케이스, 향상된 인이어 감지 등을 위한 피부 감지 센서 등 몇 가지 새로운 기능이 탑재되었다는 루머가 있습니다.애플은 새로운 에어팟 프로를 위해 애플의 비츠 스튜디오 버즈와 유사하게 이어버드 아래로 떨어지는 줄기를 제거할 더 컴팩트한 디자인을 테스트한 것으로 알려졌지만 최근 루머에 따르면 이어버드에는 큰 디자인 변경이 없을 것이라고 합니다.

5월에 Kuo는 MagSafe 배터리 팩과 같은 다른 아이폰 액세서리도 미래에 USB-C로 전환될 것이라고 예측했습니다.",nan,2022.08.09 23:06,nan,nan,11,1740,모바일 뉴스 ,nan
https://quasarzone.com/groupSearches?keyword=에어팟,퀘이사존,"번역기로 인한 오역이 있을 수 있습니다.


	






미래의 AirPods Pro는 Bluetooth 5.2 덕분에 더 나은 사운드를 가질 수 있습니다.



애플의 서류에 따르면


	





	


Apple의 AirPods Pro 이어버드는 앞으로 더 나은 음질과 더 긴 배터리 수명을 제공할 수 있습니다. Bluetooth SIG 웹사이트 의 항목에 따르면 Apple이 현재 제품보다 새로운 형태의 Bluetooth 무선 기술을 사용하는 장치를 준비하고 있기 때문입니다.(새 탭에서 열립니다).



파일에는 Bluetooth 5.3을 사용하는 장치가 언급되어 있지만 Mac 소문 으로(새 탭에서 열립니다)Apple 장치는 일반적으로 아무도 이해하지 못하는 이유로 파일에 언급된 것보다 하나 낮은 Bluetooth 버전을 사용한다고 지적합니다.



블루투스 5.2는 LE 오디오 를 위한 길을 열 것입니다 . LE는 Low Energy의 약자이며 더 나은 음질, 더 긴 배터리 수명 및 동시에 듣기를 위해 두 쌍 이상의 헤드폰을 하나의 소스 장치에 페어링할 수 있는 기능을 제공할 수 있습니다. 각 이어버드는 재생 중 동기화를 보장하기 위해 해당 장치에 대한 자체 무선 연결을 가질 수도 있습니다.


	


7월에 Bluetooth SIG는 Bluetooth LE에 대한 사양을 확인했습니다. 이는 곧 기술 출시를 사용하는 무선 헤드폰 및 보청기를 볼 수 있음을 의미합니다. Apple AirPods Pro 2 가 그 중 하나입니까? 


	


Apple은 9월 7일 에 iPhone 14 를 출시할 예정인 이벤트를 계획하고 있습니다. 그러나 일부 새로운 무선 이어폰이 함께 데뷔할 수 있을까요? 그들이 그렇지 않더라도 우리는 여전히 크리스마스 전에 볼 수 있습니다. 계속 지켜봐 주세요.",nan,2022.08.26 16:26,nan,nan,16,2444,하드웨어 뉴스 ,nan
https://quasarzone.com/groupSearches?keyword=에어팟,퀘이사존,"몇분 전에 올렸는데 이름을 노출 시켜서..ㅎ 바로 삭제했습니다..ㅠ에어팟 프로인데 빅세일 쿠폰 15%, 애플 중복 할인 쿠폰 5%, 카드사 할인 10% / 스마일 카드 12%삼성, 농협, 국민 카드로 구매 시 212,400원 / 스마일 카드로 구매시 207,680원에 구매 가능하세요.!얼마전에 25만원에 산 저는 너무 아쉽네요.. 링크 : http://item.gmarket.co.kr/Item?goodscode=2259681569",nan,2022.08.22 19:12,nan,nan,16,8368,핫딜 게시판 ,nan
https://quasarzone.com/groupSearches?keyword=에어팟,퀘이사존,"여친님 통화용으로 어바니스타, JBL, 아이리버 등 보고 있는데..(콩나물모양+커널이라는 제한조건 하에서)그냥 에어팟 프로로 가는 게 속시원할까요? 아이폰이면 그냥 살텐데 갤럭시라서 쪼금 걸리는 것도 있네요.어바니스타 런던JBL WAVE200아이리버 IB-D3030BT일단 위 3개 보고 있어요",nan,2022.03.02 00:27,nan,nan,4,495,게이밍오디오 게시판 ,nan
https://quasarzone.com/groupSearches?keyword=에어팟,퀘이사존,이 글에 썻던 것보다 약 7천원 정도 더 싸졌습니다. 더욱더 역대가에 가까워지네요,nan,2022.02.23 17:45,nan,nan,7,4148,핫딜 게시판 ,nan
https://quasarzone.com/groupSearches?keyword=에어팟,퀘이사존,에어팟3세대입니다오픈마켓중엔 위메프가 제일 싼거 같네요.저는 롯데 likit on카드를 가지고 있는데 실적충족시 온라인 쇼핑몰 10퍼할인( 월 만원한도) 혜택이 있어 21만원에 구매가 되었네요,nan,2021.11.29 18:57,nan,nan,0,4942,핫딜 게시판 ,nan
https://quasarzone.com/groupSearches?keyword=에어팟,퀘이사존,배대지 이용하여 구매 하여야합니다.택배비용까지 하면 19~20에 구매할 수 있습니다.국내에서는 22만원에 판매중이기는 하지만 조금 아끼기엔 좋다고 생각하여 가지고 왔습니다.169달러로 보이는데 결제창들어가면 149달러로 나옵니다.,nan,2021.11.26 20:32,nan,nan,9,4831,핫딜 게시판 ,nan
https://quasarzone.com/groupSearches?keyword=에어팟,퀘이사존,"아이폰으로 기변하고, 버즈 프로에서 에어팟 3세대로갈아탔는데, 지하철에서 음악이 하나도 안들리네요.오픈형 좋아해서 프로 안산건데, 노캔에 길들여진 귀는 돌아오지 않나봐요.",nan,2022.03.03 13:39,nan,nan,11,786,자유게시판 ,nan
https://quasarzone.com/groupSearches?keyword=에어팟,퀘이사존,혹시 배송중 뜨신분 계신가요?????,nan,2021.11.27 20:50,nan,nan,4,286,자유게시판 ,nan
https://quasarzone.com/groupSearches?keyword=에어팟,퀘이사존,"1) 와이프에게 에어팟 3 선물했는데 음질이 2보다는 낫다고 좋아하네요. 다만 길이가 짧아서 편한데 자주 떨어뜨린다고 합니다.구매 예정이실 분은 참조하십시요. 2) 1주동안 이어폰 케이스 작업 했습니다. (저는 GTW 270, 와이프는 에어팟 3)케이스만이라도 커플 느낌 내고자 한 번 만들어 봤습니다.
두 제품 다 도면이 없어 삽질하고, 실력도 없어 좀 허술하게 완성되었지만,
그래도 모양은 제대로 나와 다행이라고 생각합니다...ㅋㅋ


",nan,2021.11.28 19:13,nan,nan,8,324,자유게시판 ,nan
https://quasarzone.com/groupSearches?keyword=에어팟,퀘이사존,아이폰이나 애플워치로 동일하게 애플뮤직으로 듣는데 저음강조가 애플워치가 더 잘되는느낌이네요;;음향효과라던지 에어팟 eq도 초기화 했는데 아무리들어도 보컬음질은 몰라도 저음이랑 공간감이 뭔가 애플워치가 높은거같은데 왜이럴까요;;,nan,2022.03.07 10:41,nan,nan,0,353,게이밍오디오 게시판 ,nan
https://quasarzone.com/groupSearches?keyword=에어팟,퀘이사존,"현제 제가 밖에 자주 돌아다니는데 카페같은데에서 FHD기준 영상편집을 자주 하고있습니다.핸드폰이랑 같이 사용할 수 있는 이어폰이 뭐가 있을까 하다가 핸드폰도 아이폰이겠다 에어팟프로를 생각중인데요서로 연동하고 바꿔먹기도 편한데 영상편집할떄 딜레이가 심할려나요?>?사용하는프로그램은 어도비프리미어프로, 에프터이펙트구요 맥북에어 M1사용중이고 핸드폰은 XS MAX 사용중입니다 ",nan,2022.03.20 22:27,nan,nan,0,597,기타/주변기기 게시판 ,nan
https://quasarzone.com/groupSearches?keyword=에어팟,퀘이사존,"에어팟프로 주머니에 넣을때마다 계속 철가루,먼지가 붙어서 철가루 스티커 알리발로 하나 주문한게 곧 오는데, 찾아보니 안쓰는게 낫다는 말들이 있어서 의견 여쭙니다.뚜껑이 잘 안닫힌고 나중에 스티커  도색 벗겨진다고 하네요.",nan,2021.11.26 13:50,nan,nan,3,448,자유게시판 ,nan
