url,site,document,documenttype,postdate,likes,dislike,comment_cnt,views,boardcategory,documentcategory
https://quasarzone.com/groupSearches?keyword=에어팟,퀘이사존,"첫글이 질문인 점 죄송합니다..

카테고리를 어디로 해야할지 모르겠네요...

추천이나 적절한 카테고리를 알려주시면 바로 이동하겠습니다.

x이버 x식in, 옆동네에서도 물어봤으나 아시는분이 없으신건지 답변이 아예 안달리네요..ㅠㅠ



지금 이 증상 때문에 2주째 골머리입니다...

검색해봐도 다 기본적인 연결 방법만 알려주는 정보들뿐 제 경우는 찾아봐도 안보이네요...

도움 부탁드리겠습니다..



데스크탑입니다.

보드는 z270f 입니다 .



증상은

블투 동글 csr4.0 사용중이고, 몇달전까지만해도 에어팟2 연결하여 잘 사용했습니다. 

한동안 사용 안하다가 다시 사용하려 연결하려니 이미 페어링이 되어있길래 연결 눌렀으나... 

연결> 연결 끊김 > 페어링 순으로 계속 무한루프 돕니다. 

페어링 끊고나면 

페어링상태로 에어팟에 점멸 신호가 뜨는데도 데탑에선 신호가 안잡힙니다. 

다른 기기 폰이나 워치에선 뜨는 상태이구요.  




시도해본것으로는

블투 동글 재연결 (다른 포트에도 연결해봄) 

블투 디바이스, 드라이버 제거 

에어팟 페어링 끊기 

에어팟 초기화 

bth.inf내 동글 h/w id 삽입 후 재부팅 




에어팟과 동글은 정상작동하는 상태 입니다. 

얘네 둘만 쌍방 연결만 안되는 상태에요... 

에어팟은 아이폰, 애플워치, 노트북에 연결해서 사용도 하고... 

동글은 다른 블투 스피커 연결해서 노래까지도 들었습니다. 

또 뭘 건들여봐야할까요... 도저히 감이 안잡힙니다... 
",nan,2021.01.15 01:37,nan,nan,1,849,OS/소프트웨어 게시판 ,nan
https://quasarzone.com/groupSearches?keyword=에어팟,퀘이사존,어느게 현시점에서 좋을까요 ios 안드 둘다 편한데,nan,2021.01.22 04:26,nan,nan,2,375,모바일/스마트폰 게시판 ,nan
https://quasarzone.com/groupSearches?keyword=에어팟,퀘이사존,버즈 프로 사용중인유저인데 에어팟도 한번 체험해볼려하는데 안드로이드에서에 호환성은 별로인가요?에어팟은 아이폰에서만 쓰라는말을 들은적이있어서요,nan,2021.01.17 14:25,nan,nan,3,500,게이밍오디오 게시판 ,nan
https://quasarzone.com/groupSearches?keyword=에어팟,퀘이사존,ios 안드 둘다 상관없어서 버즈프로랑 에어팟프로랑 고민중인데 어느게 나을까요,nan,2021.01.22 04:50,nan,nan,2,534,게이밍오디오 게시판 ,nan
https://quasarzone.com/groupSearches?keyword=에어팟,퀘이사존,에누리 경우시 22만원대입니다.에어팟 프로도 이제 가격이 많이 내려갔네요,nan,2021.01.22 10:31,nan,nan,9,4748,핫딜 게시판 ,nan
https://quasarzone.com/groupSearches?keyword=에어팟,퀘이사존,에어팟프로 2세대 기다리려했는데 언제 나올지도 모르고 애매해서 그냥 지르려는데 쿠ㅍ에서 사면 별로라는 이야기를 들어서요.,nan,2021.01.25 22:55,nan,nan,4,488,기타/주변기기 게시판 ,nan
https://quasarzone.com/groupSearches?keyword=에어팟,퀘이사존,구글링 1페이지 검색결과 및 연관 검색어까지 다 뒤져봤습니다.메인보드 음향관련 업데이트 다 깔아줬습니다.트위치 볼때마다 지지직 거리면서 소리가 안납니다. 몇 번째인지 모르겠네요이따구로 만들지마라 사과! 사과 좋아합니다!!!,nan,2021.01.26 22:42,nan,nan,5,534,게이밍오디오 게시판 ,nan
https://quasarzone.com/groupSearches?keyword=에어팟,퀘이사존,"특정카드,포인트니 상품권통한 체감가 어쩌구 없이226850원입니다.제 기억엔 역대최저가인듯합니다..",nan,2021.01.27 11:00,nan,nan,19,3376,핫딜 게시판 ,nan
https://quasarzone.com/groupSearches?keyword=에어팟,퀘이사존,돈은 비싼데 음직은 제 귀엔 에어팟 프로가 나은거 같네요. 활용도도 많이 떨어지고 무엇보다 주변음 허용모드가 제 귀에는 아주 많이 부자연스럽네요. 돈아꼈네요. 3월에 아이패드 미니 나오면 그거나 사야겠어요....,nan,2021.01.22 23:24,nan,nan,7,835,자유게시판 ,nan
https://quasarzone.com/groupSearches?keyword=에어팟,퀘이사존,친구들이랑 하는데 블루투스로 연결하면 게임소리가 안들리고 제 마이크는 상대방한테 전달은 되는 상황인데..둘 다 가능하게 못 할까요?한쪽기능만 되는건지 ㅜㅜ 아니면... 드라이버 같은 걸 설치 안 해서 그런건지 궁금하네요.처음엔 둘다 안들렸는데 리얼텍 오디오 드라이버 설치하고 동영상이나 시스템 소리들 들리는건 됐거든요.근데 상대방 음성이랑 게임 소리만 안 들릴 뿐이었어요.ㅜ방법 아시는 분은 공유 부탁드려요~~!!,nan,2021.02.08 11:48,nan,nan,0,1497,게이밍오디오 게시판 ,nan
https://quasarzone.com/groupSearches?keyword=에어팟,퀘이사존,"엘페이 국민등록후 결제하면 226840https://www.lotteon.com/m/product/PD764667?entryPoint=mysel&sitmNo=LO1072463038_1072463039&mall_no=1&dp_infw_cd=MLT이 딜이 퍼스트먼데이 딜이라서 7500포인트 추가로 받을수 잇으니 신청하세요https://www.lotteon.com/p/event/purchasegiftzone/eventDtl?evNo=E20210127003114&mall_no=1 국민 없으면 여기서 퍼스트먼데이쿠폰적용후 결제하면 231940원 송비까지 잇어서 아쉽지만 흔히 나오는 가격이라 괜찮네요https://www.lotteon.com/m/product/LO1009587331?sitmNo=LO1009587331_1009587332&ch_no=100195&ch_dtl_no=1000617&mall_no=1&dp_infw_cd=RSI양쪽 다 퍼스트먼데이 딜이라서 7500포인트 추가로 받을수 잇으니 꼭 신청하세요

https://www.lotteon.com/p/event/purchasegiftzone/eventDtl?evNo=E20210127003114&mall_no=1 전체적으로 퍼스트먼데이쿠폰때문에 국민 없어도 괜찮은 딜이네요21만원 이하 딜 기다리다가 추가포인트까지하면 21.9정도 되서 저도 그냥 질렀습니다",nan,2021.02.01 01:51,nan,nan,2,2224,핫딜 게시판 ,nan
https://quasarzone.com/groupSearches?keyword=에어팟,퀘이사존,에어팟 프로 오른쪽 유닛이 고장나서 중고나라에서 하나 샀는데 유닛에 일련번호? 같은게 안적혀 있는데 짝퉁인가요?,nan,2021.01.31 15:11,nan,nan,4,1007,자유게시판 ,nan
https://quasarzone.com/groupSearches?keyword=에어팟,퀘이사존,"에어팟 프로를 컴터에 연결해서 쓰고 싶어서 블루투스 5.0 동글이 아무거나 사서끼워 쓰려고 하는데요, 혹시 마이크는 사용이 안될까요?",nan,2021.02.14 16:53,nan,nan,3,606,게이밍오디오 게시판 ,nan
https://quasarzone.com/groupSearches?keyword=에어팟,퀘이사존,"해외 IT 매체인 GSMArena의 영문 뉴스를 번역하였으며, 원문 기사는 상단 링크에 있습니다.해외 모바일 매체를 통해 애플이 3월 중 에어태그 및 미니LED를 채용한 아이패드 프로와에어팟3 모델을 발표할 것으로 보입니다.삼성이 최근 공개한 갤럭시 스마트태그와 흡사한 에어태그(AirTags)와 디자인은 비슷하지만 더 개선된 A14 기반 프로세서와 미니 LED 기술을 적용한 아이패드 프로를 출시할 것으로 예측했습니다.미니 LED가 적용될 모델이 아이패드 프로 12.9가 될 것으로 예상되고 있으며, 아직 아이패드 프로 11에도 적용될지는 모릅니다. 또한, 에어팟3도 공개될 것으로 알려졌으나 ANC 지원이나 디자인등에 대해서는 공개된 바 없지만, 약 200달러로 에어팟 프로보다 약 20% 저렴할 수 있습니다.*출처 : GSMArena

",nan,2021.02.17 14:20,nan,nan,10,787,모바일 뉴스 ,nan
https://quasarzone.com/groupSearches?keyword=에어팟,퀘이사존,"[지마켓] 애플, 에어팟 프로 정품 (삼성카드 중복 할인 적용시 208,580원/무배)
빅스마일데이 쿠폰과 애플, 삼성카드 중복 할인 적용시 아래 가격으로 구매가 가능합니다.
# 빅스마일데이 20%+애플 중복 할인 5%+삼성카드 10% 중복 할인 (결제단계에서 할인 적용) = 최종 가격 208,580원
# 무료배송중복 쿠폰: http://rpp.gmarket.co.kr/?exhib=35338삼성카드 중복할인: 결제 단계에서 할인 적용 가능


",nan,2021.02.18 01:28,nan,nan,3,6960,핫딜 게시판 ,nan
https://quasarzone.com/groupSearches?keyword=에어팟,퀘이사존,"유출된 에어팟 3세대 유닛 및 케이스 사진중국 IT매체를 통해 에어팟 3세대 유닛 및 충전케이스가 등장되었습니다.지난번 에어팟 3세대라고 주장했던 엑스레이 사진은 에어팟 프로의 사진을 강제로 줄인 가짜로 확인되었습니다.지난번 가짜로 판정된 엑스레이 사진그러나 이번 유출된 사진은 에어팟 프로와 비슷한 디자인이며, 그동안 공개되었던 루머와 흡사한 형태를 가졌습니다. 새로운 에어팟은 에어팟 프로의 디자인을 채용할 것입니다.에어팟 3세대 예상 렌더링 이미지또한, 새로운 에어팟은 에어팟 2세대와 동일한 5시간의 연속 오디오 재생 스펙을 제공할 것으로 예상되며, 애플은 현재 5시간의 오디오 재생 스펙을 넘어서 배터리 수명을 개선하는 작업중에 있다고 합니다.*출처 : macrumors",nan,2021.02.21 20:50,nan,nan,21,6133,하드웨어 뉴스 ,nan
https://quasarzone.com/groupSearches?keyword=에어팟,퀘이사존,에어팟 프로와 10만원 스피커 1600bt 같은거랑 비교하면 뭐가 음질이 더 좋아요?,nan,2021.03.06 19:28,nan,nan,3,445,게이밍오디오 게시판 ,nan
https://quasarzone.com/groupSearches?keyword=에어팟,퀘이사존,https://m.store.musinsa.com/app/goods/1687397무신사에서 한정수량  70%세일 하네요. 6시 시작입니다.서버터짐과 동시에 10개 품절이네요 ...,nan,2020.11.26 17:59,nan,nan,16,5172,핫딜 게시판 ,nan
https://quasarzone.com/groupSearches?keyword=에어팟,퀘이사존,"공홈에서 맥북에어 주문하고 에어팟이 오늘 먼저 도착했네요이로써 에어팟1, 에어팟2, 에어팟프로, 에어팟짭... 까지...버즈도.. 초기 모델인 아이콘X부터 다 있는데...어쩌다 보니 애플/삼성 다 모여버렸네요 ㅎㅎ",nan,2021.03.04 13:46,nan,nan,10,280,자유게시판 ,nan
https://quasarzone.com/groupSearches?keyword=에어팟,퀘이사존,한손으로 까볼려 했더니 쉽지 않더군요. 그런데 옆에 있는 스티커 뜯으니 쭈욱 뜯기긴 잘 뜯기네요.혹여나 없을까봐 조마조마 했는데 다행히도 잘 있네요.,nan,2021.03.06 13:57,nan,nan,8,322,자유게시판 ,nan
https://quasarzone.com/groupSearches?keyword=에어팟,퀘이사존,"구매 해보신 분 있으신가요? 블랙프라이데이 할인으로 181,658원인데 정품일까요?",nan,2020.11.26 18:20,nan,nan,3,713,자유게시판 ,nan
https://quasarzone.com/groupSearches?keyword=에어팟,퀘이사존,방금 쿠팡에서 에어팟을 구매 했는데 기존에 쓰던 아이패드는 바로 연결이 되었는데 핸드폰이랑 컴퓨터는 바로 연결이 안 되네요. 케이스를 열면 아래에서 에어팟 연결이라는게 올라와야 하는데 핸드폰에서는 안 뜨네요. 뭐가 문제 일까요 (핸드폰은 오늘 소프트웨어 업데이트 했고 구매링크는 아래와 같아요)(https://www.coupang.com/vp/products/210191353?itemId=625994316&vendorItemId=4643929947&pickType=COU_PICK&q=%EC%97%90%EC%96%B4%ED%8C%9F+2%EC%84%B8%EB%8C%80&itemsCount=36&searchId=26a85c4c9f6343f59b634e2c1bf9b5e7&rank=2&isAddedCart=),nan,2021.03.11 00:08,nan,nan,4,238,PC조립/견적 ,nan
https://quasarzone.com/groupSearches?keyword=에어팟,퀘이사존,12월 1일까지 무신사 에어팟프로 10명 선착순 9만9천원 이벤트하네요,nan,2020.11.27 18:03,nan,nan,5,4316,핫딜 게시판 ,nan
https://quasarzone.com/groupSearches?keyword=에어팟,퀘이사존,"안녕하세요? 기분좋은 블프 아침입니다.어제저녁쯤 169.99$에서 199.99$로 인상됬던 딜이 오늘아침 부활했습니다.주의하실 점은 직배 불가능하며 예상 배송날짜 12월말~1월초 라고합니다.아마존이 판매하는 제품으로 앱내 10불 할인 당첨되셨던 분들 사용가능합니다. (169.99->159.99)추가) 아마존에서는 애플 케어플러스를 저렴하게 구매가능합니다 29.00$ (한국 45,000\)",nan,2020.11.27 08:49,nan,nan,11,4642,핫딜 게시판 ,nan
https://quasarzone.com/groupSearches?keyword=에어팟,퀘이사존,에어팟 프로 사려고 블프 기다렸는데 전부 직구만 뜨고 국내는 안뜨네요ㅠㅠㅠ그냥 쿠팡에서 살까요..?,nan,2020.11.27 13:47,nan,nan,6,436,자유게시판 ,nan
https://quasarzone.com/groupSearches?keyword=에어팟,퀘이사존,가격이 너무 저렴해서 오히려 믿음이 가질 않네요 ㅎ 구매후기도 없는 것 같고New 가 있는 걸로 봐서 리퍼가 아닌 새제품인데 이렇게 저렴하게 파는 이유가 뭘까요?,nan,2020.11.27 21:46,nan,nan,4,461,게이밍오디오 게시판 ,nan
https://quasarzone.com/groupSearches?keyword=에어팟,퀘이사존,"처음에 에어팟 1세대 선물받아서 너무 잘 쓰고 있었는데이제 배터리도 너무 금방 닳고 , 전화통화는 거의 안되다 시피 해서 이어폰 바꾸려 하는데 추천 부탁드립니다.사용중인 폰은 노트10 인데, 여기에 쓸 블루투스 이어폰 추천 부탁드립니다.1. 크기 : 그다지 상관은 없는데 적어도 충전케이스 가지고 다닐때 너무 거추장스러운거만 아니면 됩니다.2. 성능 : 주변 소음이 클 때는 항상 불편한 적이 있어서 노이즈캔슬링이 좀 있었으면 하는 마음이 있고게임이나 유튜브 볼때 응답속도 괜찮은거면 좋겠습니다. 통화품질도 중점적으로 보고 있습니다.제가 알아본건  에어팟 프로 / 보스 QC 이어버드  / LG 톤프리 HBS-TFN7 이정도 봐놨습니다.에어팟 프로는 많은 분들이 괜찮다고 하셔서 평이 좋은것을 알고 있기에 후보에 넣어두고는 있습니다.크기는 이전 세대에 비해 조금 커졌지만 그닥 불편하진 않아 보이네요~통화품질은 에어팟 1세대 사용했던 경험에 의하면 조용한데선 괜찮은데 시끄러운데서는 좀 불편하지 않을까 생각은 들고 있습니다. 주변에 갑자기 버스같은 큰차 확 지나가면 상대방이 못듣습니다.에어팟 1세대 사용 시 유튜브 영상이나 게임 시 지연되는 거는 거의 못느꼈을정도로 괜찮았는데다른것보다 지연 시간 면에서는 에어팟이 확실히 나은듯한 느낌이 들었습니다.하지만 연결성 측면에서는..제 폰인 노트10에서는 연결이 툭하면 자꾸 끊어져서 자꾸 다시 연결하게 되어서 이게 좀 불만입니다. 이건 에어팟 종특일까요?또한 애플이 AS를 엄청 잘해주는편은 아니다보니 살짝 염려는 되네요 ㅎㅎ오프매장엘 가도 에어팟은 청음조차 못하게 하다보니 느낌을 알수도 없고 답답합니다.직접 사서 껴보지 않는 한은 알수가 없네요.보스 QC 이어버드는 우선 크기와 무게는 많이 크고 많이 무거워 보입니다. 그래도 성능만 믿음이 간다면 그정도까지는 감수하고 쓸 의향은 있지만 그래도 그 중 조금이라도 작은게 좋을듯 합니다..케이스 크기 보니까 바지 주머니에 넣으면 완전 불룩할거 같네요. 평소 외출 시 가방을 잘 가지고 다니는 편이 아니라서 이 부분은 살짝 불편할 부분으로 생각은 됩니다.노캔은 기가막히다는데 유튭이나 게임할때 지연이 좀 있다고 하더라구요뭐 핸드폰 게임을 많이 안하긴 하는데 유튜브 영상볼때도 지연 현상 생기면 스트레스 많을듯 하네요.실제로 해외 유저들이 질문답변 올린거 보면 심한사람은 5초정도까지도 지연이 있다는걸 봤습니다.이거 저만 그런건가요~ 하고 질문 답변이 오고가더라구요LG 톤프리 HBS-TFN7  이제품은 우선 크기와 무게 면에서는 다른 제품에 비해 만족스러워 보였는데정작 중요한 통화 기능은 시끄러운 곳에서는 많이 불편해 보였습니다. 테크몽님 영상 봤는데 시끄러운 곳에서는 통화 안될정도로 목소리 다 짤라먹네요..노이즈캔슬링은 어느정도일지는 모르겠지만 있긴 있는듯 하더라구요.지연 현상은 이전 세대에 비해서는 많이 좋아졌다고는 하지만.. 저도 몰랐는데 블루투스 이어폰은 기본적으로 지연현상이 다들 조금씩은 있는듯 했습니다.크기 무게는 엄청 중요한건 아니지만 시끄러운 곳에서의 통화가 어느정도 가능할것 / 노이즈캔슬링은 그래도 탑재는 하고 있을것 / 지연현상은 되도록 적은 것 이정도로 보고 있습니다.보스 이어폰 쪽으로 마음이 기울었었는데 지연 현상이 좀 있다고 해서 다시 망설이네요.다른건 몰라도 유튜브 볼때 지연되면 못참을것 같습니다.이 중에서 추천할만한게 있거나, 혹시 이거 말고도 다른 제품 중에서 추천해주실 만한 좋은제품 있을까요?",nan,2020.11.28 10:41,nan,nan,2,500,게이밍오디오 게시판 ,nan
https://quasarzone.com/groupSearches?keyword=에어팟,퀘이사존,이 제품도 추후에 사진이 올라갑니다.제품 비교 리뷰를 준비한다고 구매 했으나 정작 바빠서 창고에 박혀있던 단순 개봉품입니다.출시 초기에 에어팟 프로와 같이 구매하여 딱히 좋은것도 아니며 가품이라서 솔직히 실사용은 비추 드립니다.단지 그냥 패션용으로 가지시는걸 추천 드립니다.본래 12월 나눔 예정이였으나 12월이 바쁠듯하여 조금 앞당겨서 나눔 합니다.-나눔 조건-인증샷 필수입니다. 인증샷 안하시는 분들이 계시는데 따로 블랙리스트 만들고 있습니다.블랙리스트에 올라가면 다른 나눔에 신청 하실때 당첨에서 제외 됩니다.행성제한 : 명왕성 (현재 머블로 인한 행성 레벨 감소)으로 정했습니다.+ 최근 활동이 적다면 제외 하도록 하겠습니다.- 택배는 착불이며 편의점 택배입니다.,nan,2020.11.28 20:36,nan,nan,51,1075,나눔게시판,nan
https://quasarzone.com/groupSearches?keyword=에어팟,퀘이사존,"유선충전 A등급구매링크 : 링크가격 : $77.35무선충전 B등급구매링크 : 링크가격 : $92.65VIPOUTLET 특성상 B등급을 구매해도 완전 새제품이 올 수도 있고, A등급을 구매해도 기스 투성이가 올 수도 있습니다...ㅠ 등급은 그냥 단순 확률이 얼마나 더 높아지냐 낮아지냐의 차이랄까요.... 할인코드 : 15blackfriday유명한 배대지는 주문 취소될 가능성이 있습니다.",nan,2020.11.28 15:18,nan,nan,3,2259,핫딜 게시판 ,nan
https://quasarzone.com/groupSearches?keyword=에어팟,퀘이사존,"1. 위메프 앱이나 바로가기 on 상태(다른 새 브라우저)로 진입2. 상품 페이지 내의 모든 쿠폰(W전용구폰, 각자 사용하는 카드사 쿠폰, LG PC 브랜드 세일 쿠폰) 받기3. LG 쿠폰이 왜 적용되는지는 모르겠지만 위의 세 쿠폰을 적용하기4. 해당 카드로 결제하기(위메프롯데/카카오페이/국민/삼성/신한/비씨/현대/농협/우리/하나)도움이 되지 않는 정보라면 추천/귤을 누르지 말아주세요. 감사합니다:)",nan,2020.12.03 16:04,nan,nan,14,2491,핫딜 게시판 ,nan
https://quasarzone.com/groupSearches?keyword=에어팟,퀘이사존,"[롯데ON]에어팟 프로(271,560/0)-롯데카드 L.Pay 17만원대1. 롯데오너스는 한달 무료체험이 가능하니 댓글에서 추천인 아이디 교환하시면서 서로 가입 ㄱㄱ2. 롯데온 어플 필요3. 롯데카드 or 현대카드 필요에어팟 프로 역대급 딜이 떴습니다. 빠른 품절을 예상합니다.롯데카드와 Lpay가 필요합니다.롯데ON 어플리케이션에서 해당 상품으로 들어가셔서,롯데카드 L.Pay 결제하시면 됩니다. Lpay 결제는 웹에서는 안되는거 같습니다.일반 회원의 경우 즉시 할인가 219,970원롯데오너스 회원의 경우 즉시 할인가 217,780원이 나옵니다. 그런데 여기서 4만 포인트 페이백 신청이 가능합니다.즉 최종가는 17만 7780원~17만 9970원이 됩니다. *현대카드를 사용하시면 8000원 비싸지만 나쁘지 않습니다.스마트픽 신청하면 2000 포인트 이상 추가로 페이백됩니다.여기까지 하시면 롯데 오너스 기분 최종 가격 17만 5천원 대가 나옵니다. * 할인쿠폰https://www.lotteon.com/p/display/shop/seltDpShop/29687 * 4만 포인트 캐시백 신청https://www.lotteon.com/p/event/purchasegiftzone/eventDtl?evNo=E20201201002392&mall_no=1*L페이 최초 이용 5000포인트 캐시백 신청https://www.lpoint.com/app/event/LHEB100300.do?evnId=EVN503070도움이 되지 않는 정보라면 추천/귤을 누르지 말아주세요. 감사합니다:)",nan,2020.12.07 00:34,nan,nan,26,4905,핫딜 게시판 ,nan
https://quasarzone.com/groupSearches?keyword=에어팟,퀘이사존,오른쪽만 길에서 잃어버렸네요 ㅠ1세대라 오래되긴했어도 잃어버리니까 속쓰림 ㅎ이상하게 겨울 되면 길에서 물건 잃어버리는 경우가 종종 있네요,nan,2020.11.28 23:23,nan,nan,11,1157,자유게시판 ,nan
https://quasarzone.com/groupSearches?keyword=에어팟,퀘이사존,"최근에 선물 받아서 에어팟 프로를 사용하게 되었습니다. 액티브 노이즈 캔슬링 기능이 있는 이어폰을 처음 사용해보다 보니 놀라움을 느끼면서 사용중입니다.서론은 여기까지 하고,제대로 사용하려고 ""이어팁 착용 테스트""를 해보았습니다. https://support.apple.com/ko-kr/HT210633그런데, 에어팟 프로에 동봉된 세 가지 사이즈의 (S, M, L) 이어팁을 바꿔가면서 모두 테스트 해보았지만, 모두 통과가 안됩니다.사실 소리는 지금도 만족하고 있기는 한데, 테스트에 통과를 못하니 이 테스트에 통과하면 조금 더 좋은 소리를 들을 수 있을까 해서 통과를 해보고 싶습니다.검색을 해보니, 팁 사이즈를 바꾸다보면 맞는 사이즈의 팁이 있는 것 같은데, 저는 세 가지 사이즈 모두 통과를 못해서 질문글을 올려봅니다.이어팁을 폼팁이라든지 다른 팁으로 바꾸면 되는 것일까요? 만약 폼팁을 추천하신다면, 추천 제품도 하나 알려주시면 큰 도움이 될 것 같습니다.미리 감사드립니다.!",nan,2020.12.09 08:59,nan,nan,2,982,게이밍오디오 게시판 ,nan
https://quasarzone.com/groupSearches?keyword=에어팟,퀘이사존,"212애플이 놀라운 하이파이 오디오,  적응형 EQ, 능동형 소음 제거 및 공간 오디오를 제공하는 헤드폰을 발표 했습니다.미국과 미국외 25개국에서 오늘부터 판매되며 가격은 $549 (국내가 71.9) 입니다",nan,2020.12.08 23:54,nan,nan,28,1947,모바일 뉴스 ,nan
https://quasarzone.com/groupSearches?keyword=에어팟,퀘이사존,"가격은 $549(국내가격 71만 9천원)이고,미국에서 12월 15날 출시 예정입니다.색은 스페이스 그레이,실버,핑크,스카이 블루,그린 이렇게 5가지 입니다",nan,2020.12.08 22:46,nan,nan,156,9537,하드웨어 뉴스 ,nan
https://quasarzone.com/groupSearches?keyword=에어팟,퀘이사존,엄청 저렴한건 아닌데 필요하신분들 구입하시면 될것 같아요 현대 15%할인 금액이에요,nan,2020.12.09 01:01,nan,nan,4,4120,핫딜 게시판 ,nan
https://quasarzone.com/groupSearches?keyword=에어팟,퀘이사존,"현재 무선노캔 헤드폰 중에 노캔 성능 제일 좋다는 소니 마크4의 노캔용 마이크가 양쪽 두개씩 총 4개입니다.에어팟 맥스의 노캔용 마이크가 8개네요.25만원 차이만큼의 성능, 마이크 개수 2배 만큼의 성능을 보여준다면그러면 가격 인정할 수 있을거 같네요.아 유선케이블까지 하면 30만원 차이군요",nan,2020.12.09 08:44,nan,nan,2,497,자유게시판 ,nan
https://quasarzone.com/groupSearches?keyword=에어팟,퀘이사존,이렇게 비싼데도 1차출시국 미국에선 지금 주문하면 12~14주 뒤에나 받아볼수 있네요 ㄷㄷ,nan,2020.12.09 18:52,nan,nan,4,398,자유게시판 ,nan
https://quasarzone.com/groupSearches?keyword=에어팟,퀘이사존,,nan,2020.12.08 22:47,nan,nan,19,738,자유게시판 ,nan
https://quasarzone.com/groupSearches?keyword=에어팟,퀘이사존,?? : 애플이 내놓는거 출시전에 아무리 비싸다고 까도 다 성공하고 평가도 좋았다대략 이런 식으로 애플이 판매하는건 아무리 비싸다고 말이 나와도 모든 제품이 평가도 좋고 흥했다며애플이 내놓고 실패한 거 있는지 말해보라는 식의 의견이 꽤 보이는데해외 애플 빠들도 영상 전문용 레퍼런스와의 비교는 과대 광고였다며 돈 있는 애플 빠들의 수집용 모델이라 평가하는 프로 디스플레이어 XDR가 출시 된지는 대략 1년 밖에 안되었어요,nan,2020.12.09 19:12,nan,nan,8,961,자유게시판 ,nan
