url,site,document,documenttype,postdate,likes,dislike,comment_cnt,views,boardcategory,documentcategory
https://quasarzone.com/groupSearches?keyword=에어팟,퀘이사존,"에어팟 신한카드,삼성카드,my homeplus 로 결제시 179,000원에 구매 가능하다고 하고 기간은 제품 소진시라고 하네요! 가격대가 괜찮은거 같아서 올려봅니다. 첫 글이라 미숙한 점 죄송합니당 ㅠㅠ",nan,2019.03.09 21:32,nan,nan,4,1456,핫딜 게시판 ,nan
https://quasarzone.com/groupSearches?keyword=에어팟,퀘이사존," 
 
이번에는 앵키하우스에서 새롭게 출시한 사악한 제품 ""이탈리아 투르칸 에어팟 천연 
가죽 케이스""에 대한 리뷰입니다.
 
앵키하우스를 포코포터블코리아를 통해 처음 알게 되었는데 매번 신통방통한 악세사리 출시가 
늘어가면서 괜찮은 제품들이 늘어나고 있는데요. 
 
 
이번에는 에어팟용 케이스치고 상당히 괜찮은 놈이 등장한 거 같습니다.
 
 
리뷰를 통해 자세히 알아보겠습니다.
 
 
리뷰~ Start!!
 
 
 
 
        패키지                     
 
 

 
이탈리아 투르칸 에어팟 천연 가죽 케이스 패키지는 제품의 실물을 볼 수 있게 오픈된 디자인으로 
되어있어 제품의 상태를  확인할 수 있는 게 특징인데요.
 
 
 
패키지 전면에는 이탈리아에서 디자인되었다는 문구와 국기 모양의 컬러 라인이 무선충전도 
가능하다는 문구가 눈에 띄네요.
 
 
 
패키지 뒷면에는 케이블 연결 부위와 오픈된 커넥트 버튼 그리고 메탈 클라스프가 사용되는 
내용이 인쇄되어있습니다.
 
 
 
패키지 측면 인쇄 모습.
 
 
 
 
        제품 살펴보기      
 
 
 
 
이탈리아 투르칸 에어팟 천연 가죽 케이스 모습입니다.
 
이태리 장인이 한땀 한땀 바느질하여 튼튼하게 만드는 모습을 보시겠습니다. 
 
 
 
 

 
흔히 보는 가죽 제품의 모서리 마무리와 같은 깔끔한 가죽이 서로 겹치는 부분 또한 꼼꼼하게 
마무리되어있고요.
 

 
에어팟 충전을 쉽게 할 수 있는 오픈된 충전포트 부분
 

 
쉽게 열고 닫을 수 있는 똑딱이 커버
 

 
커버에는 이탈리아 감성을 표현하는 이탈리아 국기 컬러 바느질
 

 
케이스 커버 오픈 시 가죽의 빳빳함을 느끼지 못하게 뒷부분을 절개하여 커버를 오픈할 때 부드럽게 
 
커넥트 버튼 부분 또한 오픈형으로 디자인하여 에이팟을 케이스에 넣은 상태에서도 
기능적인 사용에 문제가 없게 디자인되었습니다. 
 

 
케이스 내부에는 에어팟 장착 시 스크래치 없이 사용할 수 있는 부드러운 재질을 사용하였으며
 

 
열을 가해 성형한 가죽을 사용하여 에어팟을 넣을 케이스와 에어팟이 겉돌지 않는 완벽한 핏을 
보여줍니다.

 
 
 
똑딱이 버튼 안쪽에는 금속이 노출되지 않게 가죽을 덧대는 꼼꼼한 이태리 장인의 손길이 
느껴지는 부분입니다. 
 
 
 
다양한 곳에 걸어서 사용이 가능한 메탈 행거의 모습
 

 

 

 
사진상의 손가락과 비교를 해보시면 아시겠지만 고리 부분이 조금 작은 느낌이 있네요.
 
 
 
 
        에어팟도 맘에 들어하는 케이스    
 
 
 
내부 충전재를 빼내고 에어팟을 넣어보겠습니다.
 

 
기존에 사용하고 있는 카탈리스트 에어팟 케이스와 비교한 모습인데요. 
 
 
카탈리스트 제품의 경우 방수와 충격보호를 목적으로 하는 케이스로 뭐랄까? 전투형 느낌으로 
사용할 수 있다면 이탈리아 투르칸 에어팟 천연 가죽 케이스 정장 같은 느낌? 으로 
사용할 수 있는 제품인 거 같습니다.
 

 
에어팟 1세대를 배터리 광탈 문제로 이어버드만 구입할까하다가 구입한 2세대 충전 케이스 
모델입니다.
 
이번 2세대 제품은 공홈에서 주문하면서 각인 서비스도 신청했는데 자릿수 제한으로 
딱 저 글만 각인이 가능하더라고요.
 
각인 내용은 제가 사용하는 도메인 주소랍니다. ^^
 

 
에어팟이 케이스에 부드럽게 좀 꽉 끼는 느낌으로 들어가는데 새 가죽 제품 느낌이 지대로 납니다.
 

 
케이스 커버를 열고 에어팟 뚜껑 여는 두 번의 과정을 거치게 되는데 이게 어느 정도 숙달이 되니 
커버를 여는 동시에 에이팟 뚜껑을 여는 스킬이 생기더군요.
 

 
커버 부분에 구멍을 통해 무선충전 케이스 시 LED 점등을 확인할 수 있고  
 

 
앞서 설명해 드린 대로 케이스 뒷면에 오픈된 커넥트 버튼의 모습. 
 

 
오픈된 충전단자의 모습.
 
 
이처럼 이탈리아 투르칸 에어팟 천연 가죽 케이스는 에어팟을 넣었을 때 케이스에서 에어팟을 
꺼내지 않고 유선 충전과 무선 충전, 무선충전에 따른 LED 점등, 페어링까지 모두 해결할 수 있는 
실용적이면서 일체감 있는 케이스 핏이 인상적이었습니다.  
 

 
이탈리아 투르칸 에어팟 천연 가죽 케이스 메탈 행거는 튼튼하면서 중후한 느낌을 주는데요.
 
가방류 고리에는 괜찮겠지만 청바지 같은 바지류의 벨트 고리에서는 장착 시 메탈 행거의 
고리 부분이 조금 좁은 느낌이 있더라고요. 
 
 
 
오픈형으로 되어있는 충전단자 부분에 다양한 케이블을 이용하여 보았는데 보는 것과 같이 
꽤 넉넉함이 느껴졌습니다.  
 
 
 
         마무리    
 

       
 
지금까지 이탈리아 투르칸 에어팟 천연 가죽 케이스에 대하여 알아보았습니다.
  
약 1주일 가까이 이 제품을 사용하면서 느낀 점은....
 
- 새련된 가죽 악세사리 느낌
- 청바지에 걸어 사용할 때 사진과 같은 심플한 핏 연출
- 에어팟을 케이스에서 꺼낼 필요가 없다는 점 
 
이러한 모든 점이 종합하면 간지작렬!!
  
가죽 소재이기에 액티비티보다는 일반적인 생활에 알맞은 제품으로 에어팟을 보호하는 동시에 
편안한 사용이 가능한 케이스라는 점을 설명해 드리며 괜찮은 에어팟 케이스를 찾으시는 
분들이라면 꼭 사용해보시라 권하며 리뷰를 마칩니다.
 
정말 맘에 드실 거에요.
 
 
다음에도 신박한 제품 리뷰를 이어가겠습니다.
 
 
 
""선정 빡세기로 소문난 포터블코리아 체험단으로 선정되어 리뷰를 내 맘대로 자유롭게 씀"" 
 
 
 
구매처 : https://smartstore.naver.com/ankihouse/products/4509210479
 

 
 
원문출처 : https://www.idsam209.com/2028
 

 
 
 ",nan,2019.06.11 00:35,nan,nan,4,712,유저사용기/필테 게시판 ,nan
https://quasarzone.com/groupSearches?keyword=에어팟,퀘이사존,저는 잘들리는데 받는 상대방마다 제 목소리가 너무 작다고하네요 이번에 새로 프로2사본건데 불량인건지..,nan,2023.11.22 11:13,nan,nan,12,330,모바일/스마트폰 게시판 ,nan
https://quasarzone.com/groupSearches?keyword=에어팟,퀘이사존,유출된 아이폰 7 플러스 패키지 후면   해외 모바일 매체인 애플인사이더에서 유출 확인된 플러스 모델 패키지를 통해아이폰 7 플러스에는 애플 에어팟이 포함될 것이라는 소식을 전했습니다. 에어팟(AirPods)은 애플이 그동안 개발해온 블루투스 무선 이어폰입니다.이외 플러스 모델에서는 라이트닝 이어폰이나 라이트닝 to 3.5파이 젠더는 찾아볼 수 없었습니다.  ,nan,2016.09.02 00:47,nan,nan,6,1025,모바일 뉴스 ,nan
https://quasarzone.com/groupSearches?keyword=에어팟,퀘이사존,"q10에 9월달에 주문한게 12일에도 
배송이 안되서(중국 국경절 문제는 배송 지연이 추가로 산 방수 케이스입니다...-.-)
취소 요청했는데 발송했다고 취소 불가능이라고 답변이 왔습니다
문제는 wd 8tb도 15일에 세관
에어팟도 배송시작해서 15일 세관
피규어도 15일 세관
아니 15일 도착했으면 세금 내야하는데 아무한테도 연락이 안옵니다
-.-
저 판매자때문에 진짜 짜증나네요
빨리 받고 싶은데 저 1개의 에어팟때문에 나머지2개는 못받고 있어요

내일 세관에 전화해야겠습니다",nan,2018.10.16 20:56,nan,nan,4,288,자유게시판 ,nan
https://quasarzone.com/groupSearches?keyword=에어팟,퀘이사존,요새 이어폰줄의 불편함을 느껴서 블투이어폰으로 바꿀려하는데갤럭시 스토어에서 갤럭시 전용 블투이어폰을 체험했었는데 제 귓구멍엔 너무나 크고 불편해서...에어팟 생각하고있는데갤럭시 폰에 에어팟 쓰시는분들 혹시 불편하거나 그런거 있으셨나요 ,nan,2018.12.26 14:27,nan,nan,0,273,게이밍오디오 게시판 ,nan
https://quasarzone.com/groupSearches?keyword=에어팟,퀘이사존,LG 트롬 건조기: 5명아이패드 프로 11형(256g) :5명에어팟 2세대: 35명LG 프라엘 4종세트: 5명 응모에 100원 결제가 필요하며(포인트 가능)미당첨 시 100원은 반환됩니다. 이거 아직도 안끝났네요~ 못하신분들 참여하세요~,nan,2019.06.10 12:11,nan,nan,5,1243,핫딜 게시판 ,nan
https://quasarzone.com/groupSearches?keyword=에어팟,퀘이사존,하앍사실 저는 블루투스 헤드폰이 2개 있었습니다만 다 처분했죠보스 이어폰으로 살아가는데 요즘따라 불편해지기 시작했습니다결국 질렸네요요즘 달러값 장난 아닙니다 139달러인데 쩝체크카드로 하면 더 나올것같아서 계좌이체로 했어요 이제 혼돈의 파라다이스입니다 관세청:뭔데 갑자기 1일에 1개씩 물건이 들어와? 이제 관세청도 저의 관종의 맛을 느끼게 될것입니다  ,nan,2018.09.29 16:41,nan,nan,18,398,IT/하드웨어 갤러리,nan
https://quasarzone.com/groupSearches?keyword=에어팟,퀘이사존," 얼마전에 청주에서 16만9천원에 판다는 글 봤는데청주까지 가기는 힘드니까 온라인으로 2천원 더주고 사는것도 나쁘지 않을거같아요 ※ 한줄평: 저번에 16만 후반대에 못구하신분들~ 이번에~~ -------------------------------------------------------------------------------------------------------지름/할인 게시판 전체에 추천이 활성화돼 좋은 딜은 추천하고 별로인 것은 지적하며 집단지성으로 딜을 판단하는 기준을 만들어가면 좋겠습니다 :)  제가 가져오는 정보글의 작성과정은,1. 정보를 보고, 2. 메리트가 있는지 판단하고,3. 현재 살 수 있는지 검증한 후, 4. 수정을 거쳐 재작성됩니다.재작성 없이 퍼온 글은 퍼왔다는 표시 대신 원글 출처가 링크로 붙어있습니다.-------------------------------------------------------------------------------------------------------",nan,2019.07.19 13:49,nan,nan,1,622,핫딜 게시판 ,nan
https://quasarzone.com/groupSearches?keyword=에어팟,퀘이사존,10~20 사이로 구매가능한 에어팟 추천좀 해주세요,nan,2019.08.27 17:39,nan,nan,1,220,기타/주변기기 게시판 ,nan
https://quasarzone.com/groupSearches?keyword=에어팟,퀘이사존,"미리 한마디로 정리 드리자면 에어팟 프로는 편리성을 극대화 한 블루투스 노이즈캔슬링 이어폰 이며소니 WF-1000XM3는 음질을 극대화 한 이어폰 입니다. 착용감에어팟 프로의 착용감은 매우 뛰어납니다. 이것은 매우 가벼운 무게와 특유의 생김새 덕분이라고 생각합니다.(장시간 착용해도 피로감이나 아픔을 느끼지 않을 것 같았습니다. 조깅 등 가벼운 운동에도 매우 어울릴것 같습니다.) 이에 반해 소니 WF-1000XM3은 착용감이 좋지는 않습니다. 이것도 무거운 무게와 특유의 생김새 덕분이라고 생각합니다.(귀에 후벼파서 넣는다. 라고 생각하시면 좋을것 같습니다. 장시간 착용하면 피로할것 같습니다.) 음질에어팟 프로의 음질은 기존 에어팟과 크게 다르지 않습니다. 쥐털만큼 음질이 나아졌다.. 라고 저는 생각합니다.(솔직히 이것조차 노이즈캔슬링의 버프라고 생각합니다만.... 특히 중저음이 별로입니다. 그냥 평소 쓰시던 에어팟 생각하시면 딱 맞을것 같습니다.) 이에 반해 소니 WF-1000XM3의 음질은 여전히 현존하는 블루투스 노이즈캔슬링 이어폰 중에서는 최고라고 생각합니다.현장감과 중저음 표현은 역시 소니라고 칭찬해주고 싶습니다.  케이스 에어팟 프로의 케이스는 기존 에어팟 케이스 크기와 크게 다르지 않습니다. 여전히 매우 가볍고, 작고, 주머니에도 잘 들어갑니다. 편리성은 완벽합니다. 이에 반해 소니 WF-1000XM3의 케이스는 큽니다.적어도 에어팟 프로 케이스 보다는 1.5배는 큽니다. 편리성 나쁩니다. 노이즈 캔슬링 (사람들이 바글바글한 긴자 에플스토어에서 청음한 점을 고려해주세요.)에어팟 프로의 노이즈 캔슬링은 드라마틱 하지 않습니다. 귀에 착용하면 자동으로 노이즈캔슬링이 작동되며작동되면 일정 소음을 걷어줍니다만, 사람들의 말소리(바글바글)는 분명히 들립니다.다만 곡을 재생하면 사람들의 말소리도 80% 이상은 걷어줍니다. 곡에 집중할수 있습니다. 소니 WF-1000XM3의 노이스캔슬링 성능은 이미 많은 분들이 칭찬하고 계시기에 생략합니다.다만 두 제품을 비교하자면, 한마디로 비슷합니다. 용호상박입니다. 아, 딱히 에어팟 프로라고 귀가 먹먹해지는 현상(무중력 느낌?)은 사라지지 않습니다.뭔가 새로운 기술을 이용한 노이즈캔슬링이라고 상상하실것 같은데 그런거 없습니다.이것도 소니랑 비슷합니다.  생김새 드디어 애플 무선 이어폰을 쓰면서 부끄럽지 않을 것 같습니다.이정도면 매우 준수하며, 조금 애플뽕을 더하자면 스타일리쉬 까지 합니다. 에어팟 프로는 귀에 칫솔이나 담배를 꽂는 이미지는 없습니다.반면 소니 WF-1000XM3 같은 경우 조금 크기가 크고 두껍기도 해서, 호불호가 갈릴것 같습니다. 마지막으로 한번더 정리하자면나는 음질을 중시한다. 소니로 가시면 될 것 같습니다.나는 편리성을 중시한다. 애플로 가시면 될 것 같습니다.",nan,2019.10.31 04:20,nan,nan,3,1539,게이밍오디오 게시판 ,nan
https://quasarzone.com/groupSearches?keyword=에어팟,퀘이사존,제목은 그렇게 썼지만 애플에서 노이즈 캔슬링 기술을 지원하는 것은 처음인 것 같아서 그 기술의 출처가 궁금했습니다.소니 같은 음향 전문 회사와 협력해서 만든 것인지 아니면 스스로 기술을 개발해서 만든 것인지 아시는 분이 계시면 답변부탁드립니다.아무리 조사해도 원하는 답이 나오지 않네요 ~한 기술이 적용되었다 등만 나오고 그 기술이 적용 된 제품은 전부 소니 제품이 나왔기에소니가 협력사인가? 하는 킹리적 갓심도 나오기도하고요.요약에어팟 프로의 노이즈 캔슬링 기술은 애플의 신기술인가 타회사의 기술을 협력 받은 것인가?,nan,2019.11.22 09:47,nan,nan,2,1003,게이밍오디오 게시판 ,nan
https://quasarzone.com/groupSearches?keyword=에어팟,퀘이사존,"구매 방법은

http://dmacshop.mireene.kr/searchaddress/intro.html

위 링크로 들어가셔서 집 근처 kt qr코드 대리점을 검색합니다.


https://m.shop.kt.com:444/m/accessory/accsProductView.do?prodNo=AC00051454

대리점 방문후 위 링크에서 주문하기 누르고 kt 멤버쉽까지 적용하셔야 154000원 구매가능하십니다. 보니까 여러개 주문도 되는거같네요.

대리점 kt직원분에게 추천인 id, 매장 접점코드 알려달라고 하시면 알아서 해주십니다.


무선도 있는데 무선은 19만원대입니다. 

https://m.shop.kt.com:444/m/accessory/accsProductView.do?prodNo=AC00051453

평소에 멤버쉽 포인트 쓸 때 별로없는데 여기다가 사용하시면 좋을 듯 하네요. 품절떠도 금방금방 재입고 되는거같네요.",nan,2019.06.28 16:47,nan,nan,3,1729,핫딜 게시판 ,nan
https://quasarzone.com/groupSearches?keyword=에어팟,퀘이사존,자세한 사항은 링크를 눌러주세요.,nan,2019.10.31 20:13,nan,nan,3,1588,모바일 뉴스 ,nan
https://quasarzone.com/groupSearches?keyword=에어팟,퀘이사존,"엘라고라는 브랜드 제품으로 케이스, 스티커 모두 구입했는데왠일인지 배송을 많이 늦게 보내서 오늘 겨우 받았네요슬림 베이직 케이스 진인디고 색상에철가루 방지 스티커 로즈골드 색입니다(설명상으로는 무려 금도금도 되있다네요)근데 스티커는 붙이기 너무 어렵고(개인적으로) 케이스는 이걸 쓰라고 만든건지 애매하네요....ㅋ케이스가 벌어져서 흰색이 다보이는것부터 윗부분은 고정?을 하려고 뭘 해뒀는데 덕분에 한번장착하면 움직이지도 않아요ㄷㄷ다음부터는 직접 매장 가서 보고 사던지 해야겠습니다그래도 스티커 열심히 붙이니까 얘는 예쁘네요 ",nan,2020.01.31 19:30,nan,nan,14,985,IT/하드웨어 갤러리,nan
https://quasarzone.com/groupSearches?keyword=에어팟,퀘이사존,"그분이 오셨어요...!!!!!!!!!!QCY만 2개 썼는데 다 고장나길래 비싼거 한번 써보자 하고 질렀습니다휴대폰은 아직 갤럭시라 아이패드에 연동시켜뒀는데 신기한게 많네요다만 음질은.... 음..... 상황에 따라 다르겠지만 QCY가 더 나은 것 같기도....그래도 노이즈캔슬링이 장난아니게 좋아서 만족중입니다ㅎ 이거 되게 신기하네요컴퓨터 팬소리, 하드디스크 소리같은게 하나도 안들려요ㄷㄷ일단 아이패드랑 며칠 더 써보고 휴대폰도 아이폰으로 바꾸고 하면서 써봐야겠습니다문제없이 오래 잘 쓰면 좋겠네요ㅎ ",nan,2020.01.29 15:07,nan,nan,12,511,IT/하드웨어 갤러리,nan
https://quasarzone.com/groupSearches?keyword=에어팟,퀘이사존,설때 사촌들 주려고 두대 구입했어요.저렴하고 평도 좋네요.https://coupa.ng/bm8dK7 ,nan,2020.01.24 11:32,nan,nan,4,3331,핫딜 게시판 ,nan
https://quasarzone.com/groupSearches?keyword=에어팟,퀘이사존,어딧-니 제발 돌아와.. ,nan,2019.10.31 20:14,nan,nan,0,702,유머 게시판 ,nan
https://quasarzone.com/groupSearches?keyword=에어팟,퀘이사존,"제가 노캔에 익숙해져서 그런가보다 했는데

찾아보니 펌웨어 업데이트 후에 많은 사람들이 동일하게 성능 저하를 체감하고 있나보네요 

언제 업데이트 다시 해줄는지.....",nan,2020.01.30 09:27,nan,nan,0,924,자유게시판 ,nan
https://quasarzone.com/groupSearches?keyword=에어팟,퀘이사존,"사촌동생이 곧 중학교에 입학하는데, 입학선물로 에어팟 2 유선을 사주려고 합니다.근데 아직 어린 나이고, 학교라는 특성상 도난 및 분실 때문에 이모도 걱정, 저도 걱정, 사촌동생 본인도 걱정 (...)선물 해주는건 고마운데 부담된다고 하더라구요. 차라리 중고로 사달랍니다. 금액을 그나마 아낄수 있게..에어팟 2세대 유선 기준미개봉은 14.5~15만, A급은 11~13만 정도에 거래되더라구요.그리고 좀 더 아래로 내려가보니 에어팟 1세대가 있었습니다. 출시된지 오래된만큼 B급정도의 제품들이었지만 6~8만원 정도.가격적으로는 1세대가 부담없겠다 싶은데, 대부분 실사용 1~2년된 제품들이다보니 내구성이 어떨지 모르겠습니다.외관은 눈에 보이는 부분이니 당연히 깨끗한 제품으로 구매하겠지만, 성능이나 배터리, AS기간등은 앱알못인 제가 알수가 없으니 ㅠㅠ배터리 상태나 AS기간을 따로 확인하는 방법이 있는건가요?",nan,2020.02.01 15:36,nan,nan,4,6372,게이밍오디오 게시판 ,nan
https://quasarzone.com/groupSearches?keyword=에어팟,퀘이사존,"슬슬 물량 푸네요.
역대 최저가는 아니지만 카드(삼성,국민,농협) 7프로 먹이고 적립까지 포함하면 30 만 원 내로 들어옵니다.",nan,2020.02.07 10:48,nan,nan,17,2211,핫딜 게시판 ,nan
https://quasarzone.com/groupSearches?keyword=에어팟,퀘이사존,"출처 : macrumors번역기 돌린 거라 오역이 많습니다.DigiTimes에 따르면, 애플은 대만의 공급망 파트너들과 ""에어팟 프로 라이트""를 포함한 추후 출시될 여러 제품들과 협력하고 있습니다. 언급된 다른 제품들에는 차세대 아이패드, 애플워치, iMac 모델이 포함되어 있는데, 아이패드와 애플 워치와 같은 제품들은 9월 이전에 출시될 것 같지 않지만, 이 제품들은 모두 향후 몇 달 안에 업데이트될 것입니다. 에어팟 프로 라이트의 언급은 더 이상의 세부사항이 없으며, 중국 내 생산에 큰 영향을 끼친 코로나바이러스 전염병 속에서 애플사의 공급망을 지역적으로 다양화하기 위해 대만의 파트너들과 생산량을 늘리려는 애플에 관한 보고서에서 다루었습니다.지난해 10월 애플이 에어팟 프로를 출시했기 때문에 디지타임스가 '에어팟 프로 라이트'에 대해  정확히 무엇을 언급하고 있는지는 불분명합니다. 2019년 3월에 2세대 일반 에어팟이 출시된 후, 그리고 에어팟 프로가 일반 에어팟의 무선 케이스 버전과 50달러 차이로 분리되고 있기 때문에, 우리는 에어팟 프로의 ""Lite"" 버전이 애플의 라인업에 어떻게 적합할지 확신할 수 없습니다.디지타임스는 종종 공급망을 통해 애플의 제품 파이프라인에 대한 통찰력을 가지고 있지만, 제품 이름과 타이밍과 같은 구체적인 세부사항에 대해서는 정확도가 낮기 때문에, 이 출판물은 일반 에어팟의 3세대가 될 수 있지만, 우리는 더 나은 결과를 얻기 위해서 추가 루머가 나타나기를 기다려야 할 것입니다.",nan,2020.02.12 23:36,nan,nan,12,2690,모바일 뉴스 ,nan
https://quasarzone.com/groupSearches?keyword=에어팟,퀘이사존,에어팟2랑 가격차이가 많이 나는데..노캔기능 들어가더니 가격 보고 놀랬네요..,nan,2020.02.07 00:37,nan,nan,0,222,게이밍오디오 게시판 ,nan
https://quasarzone.com/groupSearches?keyword=에어팟,퀘이사존,"배터리 부족해지면 뚜드려패서 리퍼받아오는용도인가요?
외의 용도가 뭐가있는지궁금합니다.",nan,2020.02.22 14:01,nan,nan,4,1835,게이밍오디오 게시판 ,nan
https://quasarzone.com/groupSearches?keyword=에어팟,퀘이사존,"노이즈캔슬링때문에 배터리를 많이먹는건지5시간정도밖에 안가네요.....;;; 사실 5시간도 체감 5시간이지 4시간 조금 더 가는 것 같습니다그리고 되게 웃긴건 배터리 없어서 전원 꺼질때까지 알림을 단 한번도 안해줘요....;;;;그냥 어느순간 효과음 들리면서 꺼져버립니다케이스 배터리는 인이어?를 3~4번정도 충전할 수 있는 정도인 것 같네요(왼쪽, 오른쪽 모두 충전 시)충전은 주로 무선충전....을 사용하는데 이것도 되게 애매합니다;;;;;무선충전기에 올려놓으면 충전 불이 올라오고 한 10초 있다 꺼지는데이게 나중에 보면 충전이 되는건지 중간에 끊긴건지 모르겠어요....개인적으로 충전중일때는 불이 항상 켜져 있었으면 좋겠습니다그외에는 은근 쓸만하네요(애플 제품에서만)휴대폰이 안드로이드라 배터리 잔량확인조차 안되는거 빼고는 잘 쓰고있습니다재미있는건 아이패드&윈도우 노트북 모두 그냥 인이어를 케이스에서 빼면 자동 페어링되는데안드로이드""만"" 매번 페어링을 시켜줘야 연결이 되네요그래도 가격이 비싸서인지 완성도나 기능 자체는 좋은 것 같습니다앞으로 왕복 4시간 통학예정인데 배터리 수명이 좀 오래 가줬으면 좋겠네요(QCY는 한 두달 쓰니까 수명이 줄어드는게 체감될 정도로 시간이 줄어들더라고요)",nan,2020.02.03 01:24,nan,nan,0,4671,자유게시판 ,nan
https://quasarzone.com/groupSearches?keyword=에어팟,퀘이사존,정말 오래 걸렸네요!,nan,2020.02.11 23:23,nan,nan,8,302,자유게시판 ,nan
