url,site,document,documenttype,postdate,likes,dislike,comment_cnt,views,boardcategory,documentcategory
https://meeco.kr/?_filter=search&act=&vid=&mid=ITplus&category=&search_target=title_content&search_keyword=에어팟,미니기기코리아,"iOS 17은 이동에 제약이 있는 iPhone 사용자의 가장 큰 접근성 장애물 중 하나인 '먼저 iPhone 잠금을 해제해야 합니다'라는 메시지를 해결했습니다. 사지 마비 장애인인 콜린 휴즈처럼 다양한 작업을 음성으로 제어할 수 있는 Siri는 접근성 측면에서 큰 도움이 됩니다. 하지만 지금까지는 큰 장애물이 있었습니다 ... 휴즈는 작년에 큰 접근성 문제인 iPhone 잠금 해제에 대해 이야기했습니다. :""내 메시지 읽기"", ""내 캘린더의 다음 일정"" 등과 같은 명령에 대해 ""먼저 iPhone 잠금을 해제해야 합니다""라는 응답이 나오는 것은 실망스러운 사용자 경험 중 하나입니다. 지금까지는 예를 들어 휠체어 옆 주머니에 아이폰이 잠겨 있으면 메시지를 확인하기 위해 아이폰을 꺼내서 잠금을 해제할 수 없었고, Siri는 항상 ""먼저 아이폰 잠금을 해제해야 합니다.""라고 불친절하게 말하곤 했습니다. 음성 제어를 사용하면 비밀번호를 말할 수 있지만 다른 사람과 함께 있을 때는 안전하지 않습니다. 그때 그가 생각한 한 가지 아이디어는 HomePod와 같은 방식으로 iPhone이 음성을 인식하는 것이었습니다. 이제 HomePod의 Siri가 개별 음성을 인식할 수 있게 되었으니, ""Siri, 내 전화기 잠금 해제해줘""라고 말하기만 하면 iPhone의 잠금을 해제할 수 있고, 그 전에 음성이 일치하는지 확인하면 완벽할 것입니다. 하지만 iOS 17에서 Apple은 이 문제를 다른 방식으로 해결했습니다. 에어팟에 새로운 Siri 인증 시스템이 추가되어 에어팟을 착용한 상태에서 기기의 잠금이 해제되면 에어팟이 범위 내에 있는 한(또는 시스템에서 출력 오디오 장치를 변경할 때까지) 인증된 것으로 간주됩니다. 따라서 기본적으로 간병인이 내 귀에 AirPod를 꽂을 때 내 iPhone이 잠금 해제되어 있으면 나중에 잠겨도 메시지, 캘린더 이벤트 등에 계속 액세스할 수 있습니다. 휴즈는 이것이 훌륭한 솔루션이라고 말합니다. :애플이 애플이라면 개인 정보 보호와 보안에 대해 걱정했을 것이라고 생각합니다. 제가 사용해 본 결과 정말 잘 작동합니다. ""Siri야""라고 반복해서 말할 필요 없이 연결된 Siri 요청은 음성 명령을 광범위하게 사용하는 사람들에게도 큰 변화를 가져다줍니다. Siri는 사용자가 언제 말을 걸고 있는지, 언제 다른 사람과 말을 걸고 있는지 알고 있습니다. 덕분에 제 삶도 더 편해졌습니다. 이제 언제든지 Siri에게 말을 걸어 새로운 요청을 할 수 있는 등 좀 더 고급스러운 작업을 수행할 수 있습니다. 이 기능은 제가 많이 사용하는 알림 알림에도 적용되어 이제 ""반복""과 ""답장""과 같은 요청을 연쇄적으로 실행할 수 있습니다. Siri는 사용자가 Siri와 대화할 때와 다른 사람과 대화할 때를 이해하므로 이제 iOS 17의 알림 알림에서 이전에는 제한적이었던 기능뿐만 아니라 Siri가 이해하는 모든 요청을 실행할 수 있습니다.",nan,2023.07.20. 02:20,nan,nan,4,808,nan,nan
https://meeco.kr/?_filter=search&act=&vid=&mid=ITplus&category=&search_target=title_content&search_keyword=에어팟,미니기기코리아,"미국특허청(USPTO)는 지난 20일(현지시간) 애플이 지난 1월 9일 출원한 '전극의 동적 선택을 이용한 생체 신호 감지 장치(Biosignal Sensing Device Using Dynamic Selection Of Electrodes)'라는 제목의 특허를 공개했다. 특허에 따르면 해당 특허는 웨어러블 전자 장치에 전극 센서를 장착하는 내용을 담고 있다. 이를통해 유저의 뇌파 신호 등을 측정할 수 있다. 애플은 EMG(근전도검사), EOG(안전도 검사), ECG(심전도 검사), GSR(피층 전기 반응), BVP(맥박도 검사) 등 다양한 신호를 측정할 수 있을 것이라고 설명했다.",nan,2023.07.24. 16:29,nan,nan,0,297,nan,nan
https://meeco.kr/?_filter=search&act=&vid=&mid=ITplus&category=&search_target=title_content&search_keyword=에어팟,미니기기코리아,버즈2 프로를 쓰고있고 음질은 만족하는데 지하철 소리를 잘 못 걸러줘서 항상 아쉽더라구요. 그렇다고 에어팟 프로2를 가자니 '굳이 또 살 필요 있나?' 싶은 와중에 비슷한 형태인 낫씽 이어2를 보게 됐습니다. 크림에서 18만9천원에 파는걸 쿠폰 써서 17만원에 살 수 있을 것 같은데 써본 분들께 음질이나 노캔이 어느정도급인지 여쭤보고 싶습니다. 사실 음질 좀 떨어져도 노캔이 좋으면 괜찮습니다ㅋㅋㅋ,nan,2023.07.18. 10:28,nan,nan,14,710,nan,nan
https://meeco.kr/?_filter=search&act=&vid=&mid=ITplus&category=&search_target=title_content&search_keyword=에어팟,미니기기코리아,"어제 핫딜타임에 가볍게 서브용으로 쓸 요량으로 질렀습니다. Ear(2)처럼 감압식 가상버튼이 적용되어 오작동이 적고, 이어폰이 가볍습니다. 착용감도 가벼운데... 오픈형이라 고정이 안정적이진 않습니다. 에어팟처럼 고무슬리브 같은 악세서리 출시를 기대하기도 어렵고요... 유닛 흰색부분이 Ear(1), Ear(2)와 달리 무광입니다. 소리 나오는 노즐부분이 옴폭하지 않고 둥글게 바로 금속 그릴이 자리잡아서(버즈 라이브와 비슷) 에어팟처럼 노즐에 귀지가 쌓이거나 할 일은 없을것 같습니다. 구멍이 촘촘해서 구멍에도 괜찮을것 같긴 한데... IP54 방수라 뭐 더러워지면 물로 씻으면 그만이고요. 음색은 정직한(?) 오픈형 소리입니다. 초기 버전 펌웨어에서는 저음이 없다시피했다고 하는데, 현재는 실내에서 들으면 적당한 수준의 저음이 나옵니다. 밖에서 들으면 저음이 빈약해지고요. 고음은 아주 사아아알짝 강조가 있는 느낌인데 거슬리진 않습니다. 에어팟이나 버즈라이브 같은 저음강조형을 기대한다면 실망할 가능성이 높습니다(EQ가 있긴 하지만...). 그 외에는 뭐... 특이하고 예쁘게 생긴거? 예쁘면 그걸로 역할을 다한거죠(...) 귀에 고정때문에 앞으로도 링크버즈가 메인 오픈형이 될 것 같긴 하지만요.",nan,2023.06.11. 13:58,nan,nan,3,726,nan,nan
https://meeco.kr/?_filter=search&act=&vid=&mid=ITplus&category=&search_target=title_content&search_keyword=에어팟,미니기기코리아,"지저분하게 열리는 패키지 & 신박한 패키지 돌리는 형식으로 전원 ON/OFF 오픈형 에어팟이 잘맞는 편인데, 불안한 착용감 앱지원은 만족만족 🥰 이거 버즈 라이브보다도 뭔가 불안한 착용감이에오 👿👿👿👿👿 너무나 가벼운데다 큰 유닛이라 불안함이 엄습하네오 뛰다 잃어버리기 딱 좋은 느낌👿 그냥 신박하지만 '낫씽'으로 수렴하는 제품👿 소리가 한없이 가벼워요 무게만큼이나 🥸 예쁘니까 봐준다요 🤔",nan,2023.06.11. 02:16,nan,nan,12,1617,nan,nan
https://meeco.kr/?_filter=search&act=&vid=&mid=ITplus&category=&search_target=title_content&search_keyword=에어팟,미니기기코리아,에어팟 프로2 베타1 올렸다가 ios 16으로 롤백했더니 베타2가 안올라가네요 ㅠㅠ 지금 다른건 다 괜찮은데 에어팟 콩나물과 본체가 자꾸 인식을 못하는지 배터리가 빠져있네요 ㅠㅠ 이번 베타2 업뎃으로 괜찮아졌는지 여쭤보고 싶습니다 ㅠㅠ ios17을 반강제로 올려야할 것 같아요... 배터리 문제가 너무 불편하네요 ㅠㅠ,nan,2023.07.20. 17:06,nan,nan,2,239,nan,nan
https://meeco.kr/?_filter=search&act=&vid=&mid=ITplus&category=&search_target=title_content&search_keyword=에어팟,미니기기코리아,"헬린이인데 운동용으로 추천해주실만한 무선이어폰있을까요? 헬린이라 아마 런닝머신에서 걷고 달릴떄 쓸경우가 많을듯합니다. 아이패드 구매예정, 맥북사용중, 아이폰15 구매예정이라.. 에어팟프로가 나을려나요.",nan,2023.07.22. 20:45,nan,nan,8,405,nan,nan
https://meeco.kr/?_filter=search&act=&vid=&mid=ITplus&category=&search_target=title_content&search_keyword=에어팟,미니기기코리아,"(트윗을 번역하자면....) ??? : 젠장, 애플아? 초록색 선은 뭐냐?? 야, 이거에 500유로**라고? 애플아 제발 좀! 저 베이스도 완전 X망했다고. 서브베이스가 매우 언밸런스하잖아. 이게 지난번에 내가 (소리를) 틀었을 때 굉장히 이상하게 들렸던 거네. ** 약 715,000 원 What the fuck apple? What is this line? (Green line)500€ guys. For this? Apple Common. Even that bass is fucked up. Sub bass is very unbalanced. That's why it sounded so weird when I tried them last time. pic.twitter.com/5l3DV373Ke— LeonLikesCatsAndMoneyDecember (@LeonMagMenschen) July 21, 2023",nan,2023.07.21. 22:50,nan,nan,9,966,nan,nan
https://meeco.kr/?_filter=search&act=&vid=&mid=ITplus&category=&search_target=title_content&search_keyword=에어팟,미니기기코리아,에어팟3세대가 노캔이 없기도하고 화이트노이즈가 거슬려서 낫싱이어스틱 한번 사볼까 싶은데 두개 비교해보면 어떨가 싶네요,nan,2023.06.12. 10:17,nan,nan,3,531,nan,nan
https://meeco.kr/?_filter=search&act=&vid=&mid=ITplus&category=&search_target=title_content&search_keyword=에어팟,미니기기코리아,﻿ S23울트라 사용중이라 당연히 폰따라 버즈2프로 구입했습니다 순정팁사이즈 별로 다 헐렁하거나 꽉끼는 느낌이라 아즈라 맥스도 구입해보고 다이소 폼팁도 구매해봤는데 오른쪽귀 외이도쪽이 얼얼하게 아프고 물집처럼? 뭐가 올라오네요 소리도 버즈2프로가 에어팟프로2보다 좋길래 이거 물건이다 했는데 제 귀에는 어떻게해도 안맞아서 런합니다...ㅠㅠㅠ 그렇다고 애플은 다 정리하고 에어팟만 남아있었는데 이거 굳이 쓰고싶진않고 버즈2프로 소리는 정말 맘에 드는데 이거 대용으로 쓸만한거 있을까요.. ﻿,nan,2023.06.12. 15:38,nan,nan,11,1011,nan,nan
https://meeco.kr/?_filter=search&act=&vid=&mid=ITplus&category=&search_target=title_content&search_keyword=에어팟,미니기기코리아,대세는 커널이다 뭐다 하는데 물론 커널이 훨씬 많지만 버즈는 버즈라. 에어팟도 오픈형 2종류고. qcy가 저려미 오픈형 몇개 만들어서 정발도 하고 낫씽 지금 특가중이고 오픈형에 선택지 없다했는데 이정도면 꽤 다양한거 같습니다.,nan,2023.06.12. 13:33,nan,nan,6,531,nan,nan
https://meeco.kr/?_filter=search&act=&vid=&mid=ITplus&category=&search_target=title_content&search_keyword=에어팟,미니기기코리아,"어제 반값딜 보고 빠르게 주문 넣었습니다. 쿠폰도 먹여서 실구매가는 6.4만원 이었네요 ㅎㅎ 1. 유니크한 디자인이 마음에 듭니다. 사이버펑크 버전 립스틱 같아요(?) 에어팟 비슷한 룩으로 통일되어 가는 무선이어폰 시장에 나타난 변종 같은 느낌이네요. 연결음 같은 것도 깔끔하게 맑은 띠링- 소리가 나는 에어팟과 달리 사이버틱한 소리여서 정체성 확실하다는 느낌을 받았네요. 케이스도 촉감이나 작동감이 자꾸 돌려보고 싶게 만듭니다. 2. 확실히 제조사 기본 액세서리의 연결성은 못 따라가는구나 하는 게 느껴집니다. 지하철에서 끊김 빈도가 에어팟보다 좀 더 높습니다. 착용 감지나 터치 제어버튼은 잘 작동하는데, 버튼 위치가 귀에 넣을 때 잡게 되는 쪽이라서 잘못 누르는 경우가 간혹 있네요. 이건 좀 적응하면 될 것 같기도..? 3. 아직 배터리가 체감될 만큼 길게 쓴 건 아니지만 재생시간은 꽤 준수한 거 같습니다. 다만 노이즈캔슬링이 없어서 밖에서 데일리로 쓰기에는 좀 힘들 거 같습니다... 집 안에서나 비교적 조용한 공간에서는 괜찮을 거 같네요. 4. 개인적으로는 기본 설정에서 고음이 조금 날카롭게 들려서, 공식 앱 이퀄라이저로 낮추니까 들을 만 하네요. 소리 자체는 뭐 특별할 것 없는 오픈형 이어폰인데 고음이 부스팅 되어있는 느낌입니다. 에어팟 프로 2세대를 계속 쓰다가 넘어오니 베이스가 좀 약하게 느껴지긴 하네요. 5. 무선충전이 없는데 기본 케이블도 엄청 짧아서 불만입니다. 집에서 무선충전으로 폰이랑 액세서리 다 충전할 수 있는 환경을 맞춰놨는데 혼자 튀네요 ㅜㅜ 6. 결론적으로는 6만원 중반대에 구매해서 만족스럽지만, 제 값 주고 사기에는 좀 애매한 제품일 듯 하네요. 후속작이 나온다면 사운드랑 무선충전을 보강하면 좋겠지만, 디자인 컨셉을 유지하는 이상 공간 문제로 무선충전은 들어가기 힘들어 보입니다.",nan,2023.06.11. 17:45,nan,nan,0,454,nan,nan
https://meeco.kr/?_filter=search&act=&vid=&mid=ITplus&category=&search_target=title_content&search_keyword=에어팟,미니기기코리아,버즈 프로 쓸땐 그런적이 딱히 없었는데 에어팟 프로2세대 구매후에 케이스에 넣는 방식의 차이라 그런지 한번씩 한쪽이 덜 충전 될때가 있네요 그러면 세게 한번 안쪽 불어주고 면봉으로 닦아주고 하면 괜찮아지는군요,nan,2023.06.12. 11:24,nan,nan,7,560,nan,nan
https://meeco.kr/?_filter=search&act=&vid=&mid=ITplus&category=&search_target=title_content&search_keyword=에어팟,미니기기코리아,"일단 스마트폰 S22, 태블릿 S7+, 기존에 쓰던 이어폰 버즈 프로로 모두 갤럭시 생태계에서 살고있는데 요즘 구매한지 2년이 지나가니 충전이 이상해지고 노캔이 약하다는 느낌이 들어서 새로 구매 고민중입니다.. 에어팟 프로 2세대 구매하면 노캔 성능이 좋아지는 대신 배터리 시간과 연결성, 음질면에서 너프되는 것같은데 버즈2 프로를 구매하자니 노캔 성능이 부족할 것같아서 너무 고민되네요 태블릿은 조만간 아이패드 프로 구매 생각중인데 어떤게 좋을까요..?",nan,2023.06.12. 01:16,nan,nan,10,751,nan,nan
https://meeco.kr/?_filter=search&act=&vid=&mid=ITplus&category=&search_target=title_content&search_keyword=에어팟,미니기기코리아,소리 생각보다 좋고 뭣보다 엄청 이쁜데요?? 물론 갤버즈2프로처럼 조미료 잘 친 느낌은 아니긴 한데 깔끔하니 좋네용 자기 전에 asmr듣는 용도로 쓰던 에어팟1세대가 죽으려고 해서 산건데 6만원에 이정도면 대만족이네용,nan,2023.06.12. 22:20,nan,nan,1,395,nan,nan
https://meeco.kr/?_filter=search&act=&vid=&mid=ITplus&category=&search_target=title_content&search_keyword=에어팟,미니기기코리아,이거 멀티포인트는 기대도 안하는데요. 멀티페어링은 되겠죠?? 에어팟이나 버즈처럼 안되겠지만. 기기 전환시 하나 끊고 하나 연결하고 해야하나요?,nan,2023.06.12. 14:25,nan,nan,6,512,nan,nan
https://meeco.kr/?_filter=search&act=&vid=&mid=ITplus&category=&search_target=title_content&search_keyword=에어팟,미니기기코리아,특가 알려주신 미코분들 절 받으세요. 제 기준에서 제가 써본 오픈형 중에 가장 편합니다. (그동안 버즈라가 최강자였는데) 귀에 딱 붙네요. 소리도 매우 제 취향입니다. 감압식도 마음에 들고요. 에어팟3과 같은 가격으로 경쟁하면 모를까. 6만원에서는 가장 좋은 선택이네요. 무충 안되는건 좀 아쉽지만 대신 배터리 길어서 크게 불편할거 같진 않네요.,nan,2023.06.13. 22:47,nan,nan,5,1599,nan,nan
https://meeco.kr/?_filter=search&act=&vid=&mid=ITplus&category=&search_target=title_content&search_keyword=에어팟,미니기기코리아,"애플의 인기 제품인 에어팟은 아이폰, 아이패드, 맥과 함께 사용할 때 그 기능을 가장 잘 발휘한다. 하지만 닌텐도 스위치 게임 콘솔을 비롯한 애플 이외의 제품과 사용해도 매우 훌륭한 무선 헤드폰 역할을 수행한다. ⓒ Foundry 여기서는 에어팟을 닌텐도 스위치와 연결하는 방법을 설명한다. 예전에는 까다롭고 어댑터가 필요했지만,...기사 더 읽기",nan,2023.06.20. 10:30,nan,nan,0,277,nan,nan
https://meeco.kr/?_filter=search&act=&vid=&mid=ITplus&category=&search_target=title_content&search_keyword=에어팟,미니기기코리아,쿠팡 특가로 QC45 29에 떴길래 겟을 하긴 했는데요 아직 안뜯어서 이걸 환불해야할지 고민입니다 맥스가 써보니까 1시간 가량 쓰니 뒷목이 진짜 뻐근하더라구요 ㅠㅠ 라이트닝 충전 온리인것도 덤... 대신 QC45는 가볍기도 하고... 씨타입이기도 하구요 맥스는 아이패드 아이폰 전환이 빨라서 좋긴 했는데 QC45도 두개까진 멀티포인트를 지원한다고 하네요? 참 고민입니다 ㅠㅠ 맥스도 30 정도에 업어온지라 당근하면 QC45 가격은 받을 수 있을 것 같긴 합니다 ㅠㅠ,nan,2023.06.16. 01:36,nan,nan,2,439,nan,nan
https://meeco.kr/?_filter=search&act=&vid=&mid=ITplus&category=&search_target=title_content&search_keyword=에어팟,미니기기코리아,"14일(현지시간) 경제전문 매체 인사이더는 중국 컨설팅 업체 웰센XR을 인용해 애플의 혼합현실(MR)용 헤드셋 ‘비전 프로’에 부품을 공급하는 업체 가운데 8곳이 중국 기업이라고 보도했다. 중국 기업 중엔 카메라 모듈 제조사인 코웰이홀딩스와 애플 에어팟 협력사인 럭쉐어 등이 포함됐다. 다른 공급사로는 한국 삼성전자와 LG, 대만 폭스콘, 일본 소니가 있었다.",nan,2023.06.15. 12:13,nan,nan,0,267,nan,nan
https://meeco.kr/?_filter=search&act=&vid=&mid=ITplus&category=&search_target=title_content&search_keyword=에어팟,미니기기코리아,개인 맞춤형 음량은 아직 좀 이상하더라구요 학습해야 한다고는 하는데 갑자기 노래가 커졌다 작아졌다 해서 불호 였습니다 😭,nan,2023.06.19. 17:28,nan,nan,8,812,nan,nan
https://meeco.kr/?_filter=search&act=&vid=&mid=ITplus&category=&search_target=title_content&search_keyword=에어팟,미니기기코리아,wf 1000xm3 사용중인데 엑스페리아에 연결할때랑 아이폰에 연결할때랑 음질이 뭔가 다르네요 제가 막귀라 음질 구분은 못하는 편인데 뭔가 다르기는 합니다 물론 플라시보 일지도 모르겠는데 버즈 시리즈나 에어팟도 이런 경우가 있는지 모르겠네요,nan,2023.06.20. 01:44,nan,nan,5,822,nan,nan
https://meeco.kr/?_filter=search&act=&vid=&mid=ITplus&category=&search_target=title_content&search_keyword=에어팟,미니기기코리아,9%에서 51%까지 충전했는데 나중에 보니 갑자기 0%로 곤두박질쳤더라고요. 다행히 유닛은 배터리 안 닳고 케이스만 닳았는데 구글링으로 찾아보니 나의 찾기에서 삭제 후 재등록을 하라고 하더라고요 다행히 재등록 후엔 급격한 방전은 없는 대신 평소보다 케이스의 방전속도가 빨라진 느낌입니다. 사용하지 않고 가만히 두었는데도 2시간만에 4%가 빠지네요. 요새 무슨 이슈가 있었을까요? 아니면 자동으로 업데이트된 소프트웨어가 문제일까요?,nan,2023.06.22. 19:07,nan,nan,4,725,nan,nan
https://meeco.kr/?_filter=search&act=&vid=&mid=ITplus&category=&search_target=title_content&search_keyword=에어팟,미니기기코리아,왼쪽만 처음 넣으면 충전이 안되어있습니다 오늘도 일어나보니 왼쪽 배터리만 충전이 안되어있어서 다시 뺐다 꽂으니 잘되네요;;; 혹시 다른 분들도 이런 증상 있으신가요? ㅠㅠ 애케플 들어놔서 리퍼해야할지 ㅠㅠ,nan,2023.06.23. 07:11,nan,nan,4,359,nan,nan
https://meeco.kr/?_filter=search&act=&vid=&mid=ITplus&category=&search_target=title_content&search_keyword=에어팟,미니기기코리아,"오픈형 선호하는 유저라 에어팟 3세대, 최근에 핫딜로 업어온 낫싱 이어스틱 이렇게 사용하는데 최근에 커널형의 필요성을 느껴서 고민 끝에 확 질러버렸습니다. 긱한 감성 극ㅡ호.. 리뷰가 많이 없긴 하지만 그래도 기본 이상은 해주는 거 같네요",nan,2023.06.23. 15:23,nan,nan,6,593,nan,nan
https://meeco.kr/?_filter=search&act=&vid=&mid=ITplus&category=&search_target=title_content&search_keyword=에어팟,미니기기코리아,에어팟 끼고 시리 부르면 볼륨이 맥스 되는 버그가 다시 돌아왔습니다 ㅋㅋ,nan,2023.05.21. 11:15,nan,nan,5,444,nan,nan
https://meeco.kr/?_filter=search&act=&vid=&mid=ITplus&category=&search_target=title_content&search_keyword=에어팟,미니기기코리아,아이폰 + 애플워치 + 에어팟 조합을 드디어 맞추게 되었는데 애플워치 충전이 영 애매하네요 다른 애들이야 서드파티 맥세이프 쓰고 있는데 워치는 좀 애매해서 아싸리 그냥 3in1 쓰려고 합니다 쿠팡에 검색하니 제품 자체는 엄청 많은데 다들 평이 애매하네요 혹시 괜찮은거 있을까요? 아니면 한방에 벨킨 가는 게 답일까용?,nan,2023.05.12. 10:13,nan,nan,9,341,nan,nan
https://meeco.kr/?_filter=search&act=&vid=&mid=ITplus&category=&search_target=title_content&search_keyword=에어팟,미니기기코리아,"17일(현지시간) 폰아레나에 따르면 비츠는 '비츠 스튜디오 버즈 플러스(+)'를 출시했다. 낫싱 이어와 비슷하게 투명 버전 디자인을 추가한 것이 눈에 띈다. 전작대비 최대 1.6배 더 강력한 액티브 노이즈 캔슬링(ANC) 기능을 탑재했다. IPX4 등급의 방수 기능도 갖췄다. 배터리 수명은 최대 36시간(충전케이스 27시간, 이어버드 9시간)이다. 3배 더 커진 마이크, 공간 오디오, 핸즈프리 시리(Siri)도 지원한다. (영상=비츠 유튜브) 스튜디오 버즈는 에어팟보다 개방적이다. 구글 패스트 페어 및 기기 찾기 기능을 지원해 안드로이드 스마트폰과도 호환이 잘 된다. 가격은 169.99달러(약 22만7천원)이다.",nan,2023.05.18. 10:23,nan,nan,4,845,nan,nan
https://meeco.kr/?_filter=search&act=&vid=&mid=ITplus&category=&search_target=title_content&search_keyword=에어팟,미니기기코리아,갤+에 아+버 갤+버 아+에 갤+기타 아+기타 다 써봤는데 만원전철 + 주머니에 넣은 상황에서 안 끊긴 건 갤+버가 유일하네요 아이폰은 에어팟이랑 연결하면 좀 나은데 다른 회사도 아니고 자기들 자회사에서 만든 비츠랑 연결해도 끊기네요 이거 참...ㅋㅋㅋ,nan,2023.05.10. 08:34,nan,nan,3,738,nan,nan
https://meeco.kr/?_filter=search&act=&vid=&mid=ITplus&category=&search_target=title_content&search_keyword=에어팟,미니기기코리아,"Apple(애플) 정품 액세서리를 판매 중인 편의점 이마트24가 'Apple Pay(애플페이)'와 손잡고 iPhone(아이폰) 사용자를 위한 할인 이벤트를 연다. 이마트24는 오는 11일부터 31일까지 Apple 정품 액세서리 전 품목을 Apple Pay로 결제 시 10% 할인 혜택을 지급하기로 했다. 이마트24 제휴 서비스 중복 할인과 적립도 가능하다. 앞서 이마트24는 2020년부터 오프라인 매장 내에 Apple 정품 액세서리 전용 판매대를 설치하고 AirPods Pro(에어팟 프로), AirPods(에어팟), EarPods(이어팟), 어댑터, 케이블 등 총 20여종의 Apple 정품 액세서리를 판매하고 있다.",nan,2023.05.10. 09:21,nan,nan,0,363,nan,nan
https://meeco.kr/?_filter=search&act=&vid=&mid=ITplus&category=&search_target=title_content&search_keyword=에어팟,미니기기코리아,"에르메스는 에어팟 프로용 가죽케이스를 발표했습니다. 이 제품은 에르메스가 자주 사용하는 스위프트 가죽으로 만든 제품으로, 목이나 가방에 걸 수 있는 넥스트랩이 함께 제공됩니다. 무선충전에도 대응하지만 맥세이프는 지원하지 않습니다. 에어팟 프로 1세대와 2세대 모두 사용할 수 있지만, 2세대를 위한 스트랩홀이나 스피커 구멍은 뚫려있지 않습니다. 이 제품의 가격은 $930 입니다. 또 프로 2세대 충전케이스에 바로 걸 랜야드만 필요한 사람들을 위해 랜야드도 같이 출시했습니다. 랜야드 역시 스위프트 가죽이며 5가지 색상, 가격은 $335 입니다.",nan,2023.05.18. 14:55,nan,nan,3,715,nan,nan
https://meeco.kr/?_filter=search&act=&vid=&mid=ITplus&category=&search_target=title_content&search_keyword=에어팟,미니기기코리아,저 수많은 애플스토아 아이폰들중 기기 바로앞에 있는거만 칼같이 연결하는게 대단하네요.. 에어팟 인식속도 또한 인상적이네요 ㄷㄷ,nan,2023.05.14. 21:33,nan,nan,11,1671,nan,nan
https://meeco.kr/?_filter=search&act=&vid=&mid=ITplus&category=&search_target=title_content&search_keyword=에어팟,미니기기코리아,하지만 전 제발 홈팟 다시좀 ㅠㅠ,nan,2023.06.06. 02:58,nan,nan,0,251,nan,nan
