url,site,document,documenttype,postdate,likes,dislike,comment_cnt,views,boardcategory,documentcategory
https://meeco.kr/?_filter=search&act=&vid=&mid=ITplus&category=&search_target=title_content&search_keyword=에어팟,미니기기코리아,"버즈 푸로의 v자형을 좋다하지만 버즈 2프러는 차분해자면서, 소리가 더 밝아진 느낌이고 지하철 노캔은 엉망진창(그나마 큰팁으로 극복 가능하나 압박감크리 🥲) 후로팟푸로2는 오히려 단단해진 소리라 이쪽이 더 제취향이네오 게다가 압도적인 노캔과 주변소리듣기에서 그만정신을 잃고말았쯤니다.. WF1000XM4 폼팁 신공보다 더 뛰어난 노캔에 리얼안낀 초박형 주변소리듣기소리.. 대단하다고 느꼈습니다 🤔",nan,2022.09.26. 22:47,nan,nan,21,1220,nan,nan
https://meeco.kr/?_filter=search&act=&vid=&mid=ITplus&category=&search_target=title_content&search_keyword=에어팟,미니기기코리아,오랜만에 지름신이 오는걸보면 이건 출시하고 바로 사라는 계시겠죠?,nan,2022.09.26. 22:33,nan,nan,6,551,nan,nan
https://meeco.kr/?_filter=search&act=&vid=&mid=ITplus&category=&search_target=title_content&search_keyword=에어팟,미니기기코리아,"(예전에 에어팟 프로 가로수길에서 청음했을 때의 사진입니다) 개인적으로 에어팟 프로 2세대 디자인 변경없다는 걸 확인하고 바로 포기했습니다. 예전에 에어팟 프로 청음했을 때에 도저히 착용 각도가 안 나와서 포기했었는데, 그 디자인 그대로 간다고 하니 이건 들어보기에도 애매하겠더군요..;; (참고로 저 착용샷에 사용된 팁은 L 사이즈 입니다) 이때 귀 형상이 콩나물형과는 절망적으로 안 맞는 걸 체감하고 결국 버즈→버즈+만 주구장창 썼습니다.. orz 이후에 다른 콩나물형인 Nothing Ear(1)도 사용했었는데 걔도 완벽하게 밀폐가 되는 구조는 아니더군요.. 이번에 L 사이즈 이어팁이 좀 커진 것 같다는 정보도 있긴 하던데 그 정도로 해결이 될지 의심스러운 상태여서 일단 정발할 때까지는 지켜봐야겠습니다. (청음하려면 서울 올라가야 한다는 게 큰 문제이지만..)",nan,2022.09.27. 00:45,nan,nan,1,638,nan,nan
https://meeco.kr/?_filter=search&act=&vid=&mid=ITplus&category=&search_target=title_content&search_keyword=에어팟,미니기기코리아,anc가 말로만 좋다 대단하다가 아닌 측정치를 봐야 어느 정도인지를 아는데 아직 한 군데 말고는 못 찾겠네요. 근데 여기서는 그래프만 보면 프로1이랑 2랑 차이가 너무 크게 나서.. 빨리 다른 곳에서도 측정치가 나오면 좋겠습니다,nan,2022.09.28. 12:42,nan,nan,6,427,nan,nan
https://meeco.kr/?_filter=search&act=&vid=&mid=ITplus&category=&search_target=title_content&search_keyword=에어팟,미니기기코리아,아직도 출시일은 추후 공개됩니다 라니 용서할 수 없습니다,nan,2022.09.28. 13:30,nan,nan,4,370,nan,nan
https://meeco.kr/?_filter=search&act=&vid=&mid=ITplus&category=&search_target=title_content&search_keyword=에어팟,미니기기코리아,"MacRumors가 Lumafield를 통해 확인한 CT 스캔 이미지에 따르면 에어팟 프로 2의 기본 레이아웃은 기존 에어팟 프로와 유사하지만, 랜야드 루프가 독자적으로 설계된 게 아닌 로직 보드와 라이트닝 커넥터에 내부적으로 연결되어 있음을 확인할 수 있었다. 이를 통해 에어팟 프로 2의 랜야드 루프는 U1 칩의 안테나 역할을 하거나 다른 추가 목적이 있음을 알 수 있다. 만약 안테나 칩 역할을 할 경우 랜야드 루프는 나의 찾기 지원 활성화를 위한 충전 케이스 위치 추적용 안테나일 가능성이 크지만, 접지를 위한 연결부일수도 있다는 의견 역시 제시되었다. 기사 더 읽기",nan,2022.09.28. 13:36,nan,nan,0,228,nan,nan
https://meeco.kr/?_filter=search&act=&vid=&mid=ITplus&category=&search_target=title_content&search_keyword=에어팟,미니기기코리아,"제가 원래 스펙상 내용이 아닌 다른 기능이 되면 흥분을 멈추지를 못해서;;; 일단 아까 제가 테스트했던 건 다 잊어주시고... 중요한 건 계정이 H2칩에 박제되는 것 같습니다. 좀전에 테스트를 했을 때 로그아웃 상태에서 페어링 하면 자꾸 꼬이더구만요. 정리를 하자면... 1. 로그아웃 안 하고 비행기 모드로 돌린다. (혹시 모를 네트워크 원천 차단) 2. 블루투스 메뉴에 들어가서 기존 페어링 에어팟 다 삭제시킨다. 3. 에어팟 뚜껑 버튼 꾹 눌러서 주황색으로 완전히 공장초기화 시킨다. 4. 그 뒤로 아이폰하고 아이패드, 맥북에 수동 연결시킨다. 5. 별다른 네트워크 없어도 세 장비 왔다갔다 잘 작동한다. 근데 이게 로그아웃 상태에서는 안 된다는 애플 말이 맞구요. 고로 이걸 따져봤을 때 같은 계정 한해서 자동 전환이 된다는 것 자체가 H2 칩에 본인 계정에 대한 정보가 들어가는 게 아닌가 합니다. 이상한 버그? 때문에 갑자기 제 아이폰과 윈도우 랩탑이 멀티포인트로 버그성 작동을 했던 게 아닌가 싶고요. 멀티포인트는 확실한데, 애플이 자사 기기 게다가 동일 계정 아니면 작동 안되게 막은 것 같네요. 그리고 좀전에 다시 디버깅 툴을 확인한 결과 맥에서 재생 중일 때도 ACL Connection은 0이고 Audio ACL Connection이 1로 올라가구요. 아이폰에서 재생 중일 때도 RSSI, Raw RSSI 요동치네요.",nan,2022.10.27. 19:02,nan,nan,6,429,nan,nan
https://meeco.kr/?_filter=search&act=&vid=&mid=ITplus&category=&search_target=title_content&search_keyword=에어팟,미니기기코리아,"코덱 지원 SBC, AAC 밖에 안되고 요즘 QCY도 넣는 노캔도 없고.. (오픈형이라 노캔 의미 크진 않겠지만) 멀티포인트 지원X 스펙표 보니 케이스 무충도 안됨.. 이럴 거면 몇만원 더 보태서 에어팟3를 사겠네요 허허",nan,2022.10.28. 14:32,nan,nan,3,344,nan,nan
https://meeco.kr/?_filter=search&act=&vid=&mid=ITplus&category=&search_target=title_content&search_keyword=에어팟,미니기기코리아,제가 가장 원했던 케이스 상태로 찾는 기능이 좋습니다 UWB로 찾는거 너무 편해요 아침에 이어폰 찾는것도 일인데 평소에 케이스에 눟다보니 다른 이어폰들은 전원이 꺼져있어서 찾기 불편했거든요 가격이랑 고음질 코덱만 빼면 정말 좋긴 좋네요 이거,nan,2022.10.28. 09:10,nan,nan,0,224,nan,nan
https://meeco.kr/?_filter=search&act=&vid=&mid=ITplus&category=&search_target=title_content&search_keyword=에어팟,미니기기코리아,생태계로 가두리 양식 하는 애들이 멀티포인트를 지원할 리가 없고 특히 그게 독자의 애플이라면 더더욱 그럴 것이 자명할 것이며 가두리 양식이 실패한 것도 아니고 보란듯이 성공했으니 그럴 당위성은 더더욱 없을 것이고 생태계로 성공한 애들이 멀티 포인트야 가능하다 해도 뭐 진작에 막았을 거고요 저걸 기반으로 생각해보면 어쩌다 얻어 걸린 것이거나 버그일 가능성이 99.999999999%일 건 자명하고요 그냥 뭐 당연한 결론이 나오는 그런 떡밥이었네요 늘 그렇듯 자체 생태계를 외치는 버즈고 에어팟이고 그런 탈플랫폼 통합 기능 따위는 기대하지 않는 게 좋습니다 포기하면 편해요,nan,2022.10.28. 01:30,nan,nan,1,637,nan,nan
https://meeco.kr/?_filter=search&act=&vid=&mid=ITplus&category=&search_target=title_content&search_keyword=에어팟,미니기기코리아,참고로 버즈 시리즈도 멀티포인트를 지원하지는 않지만 소프트웨어를 통한 유사 멀티포인트 기능을 지원 중이죠. 에어팟도 버즈시리즈 처럼 찐 멀티포인트 기능이 아니라 소프트웨어를 통한 유사 멀티포인트 기능을 지원한다 정도로 이해하면 되려나요?,nan,2022.10.27. 19:09,nan,nan,2,521,nan,nan
https://meeco.kr/?_filter=search&act=&vid=&mid=ITplus&category=&search_target=title_content&search_keyword=에어팟,미니기기코리아,"멀티페어링 : 여러 대의 기기를 페어링한 정보는 가지고 있지만, 동시에 여러 기기를 연결하지는 않음. 5대면 그 중 1대에만 연결됨. 멀티포인트 : 2대 이상의 기기를 동시에 연결. 각 기기 블루투스 정보에서 동시에 연결 중이라고 뜨면 멀티포인트. 가끔 보면 멀티페어링도 멀티포인트와 비스무리하게 여러 기기에 동시에 붙는다고 생각하는 사람이 많던데 에어팟 1세대 보면 전형적인 멀티페어링이었죠. 폰, 패드, 맥, 안드 이렇게 있으면 4대 다 지원은 되나 각 기기에서 터치해서 그 기기에 물릴 수는 있어도 동시 연결은 불가능하죠.",nan,2022.10.29. 11:31,nan,nan,7,473,nan,nan
https://meeco.kr/?_filter=search&act=&vid=&mid=ITplus&category=&search_target=title_content&search_keyword=에어팟,미니기기코리아,"이어스틱에서 되었으면 좋겠지만 안되는게 두가지 있습니다. 무선충전과 멀티포인트 인데요. 먼저 무선 충전은 사실 저는 꼭 있을 필요는 없습니다. 그리고 멀티 포인트인데요. 그런데 멀티 포인트 안된다고 하시는 분들이 신기한게 멀티 포인트 되는 기기가 정말 희귀하지 않나요? 삼성꺼는 안되는걸로 알고 있고 qc earbuds2 도 안되는 걸로 알고 있고 요번에 소니에서 업데이트로 해준다고 하는데 그게 신기 한것일뿐 어쨌든 끝판왕급에서도 전혀 안되는 것들이 많은데 뭔가 멀티포인트 안된다고 하면 멀티 포인트 없는게 이상하다고 생각하시는 분들이 많은 것 같습니다. 애플 멀티 포인트는 무슨 일인지 모르지만 지금 글들도 많은데;;; 읽지 않아서 뭔지는 모르겠습니다. 기대 하는 점은 네가지 입니다. 착용감, 디자인, 6시간인지 7시간인지 한다는 긴 재생 시간 그리고 디자인. 이것 때문에 오픈형을 사는거라 귀에 잘 맞았으면 좋겠습니다. 버즈 라이브가 잘 맞으면 좋겠었는데 너무 큽니다. 그리고 디자인이 두번 들어가있는데 이뻐서 사는 건 맞습니다. ㅎㅎ 마이너3는 정말 에어팟 검은 버전같고 이쁩니다만 이어스틱은 독특하고 아방가르드적이어서 구매 합니다. 그리고 재생시간이 긴것도 맘에 듭니다. 오면 리뷰를 해봐야겠습니다..",nan,2022.10.29. 14:58,nan,nan,5,482,nan,nan
https://meeco.kr/?_filter=search&act=&vid=&mid=ITplus&category=&search_target=title_content&search_keyword=에어팟,미니기기코리아,"톤프리 T90이 돌비애트모스 세계최초로 도입되어 구매하였는데 그동안 가격 279,000원에 라방에서 할인과 사은품 이것저거 주면서 체감가격 230,000원했는데 지마켓에서 세일기간 통크게 행사하네요 209,000원에 케이스 및 BHC 치킨셋트와 스타벅스 아메리카노 주네요 실체감가는 170,000원 정도할 듯 합니다 관심있으신분들 참고하세요 개인적으로는 음질은 저음이 풍부하고 고음 해상력도 좋고 돌비애트모스가 되어 영화보기 딱 좋은 이어폰입니다. 착용감은 워낙 좋기로 소문이 낫고 동글기능으로 인해 재미있게 사용하고 있습니다. 단점으로는 ANC가 약한데 버즈2프로와는 비슷하고 에어팟프로 보다는 고음 차단이 덜됩니다 외부소리 듣기도 좋긴한데 에어팟프로가 워낙 원탑이여서 대항은 안됩니다 안드로이드와 iOS 양쪽에 멀티포인트가 되어 편리하긴 합니다. http://item.gmarket.co.kr/Item?goodscode=2570334277&jaehuid=200003657",nan,2022.11.01. 18:40,nan,nan,13,638,nan,nan
https://meeco.kr/?_filter=search&act=&vid=&mid=ITplus&category=&search_target=title_content&search_keyword=에어팟,미니기기코리아,유독 버즈만 욕먹는거 같네요 에어팟프로2세대도 네이버 예판부터 36만짜리가 28만언더까지 갔는데 버즈2프로 핫딜나오면 유독 원래 가격이 말이 안된다 더 싸야 한다고 하는거 같아요,nan,2022.11.01. 15:56,nan,nan,10,534,nan,nan
https://meeco.kr/?_filter=search&act=&vid=&mid=ITplus&category=&search_target=title_content&search_keyword=에어팟,미니기기코리아,"노래가 자꾸 일시중지 되는데 스트레스 받네요. 혹시 동일 증상 이신 분 계신가요? 에어팟프로2, 에어팟맥스 둘다 동일합니다. 기종은 14프로맥스구요.",nan,2022.11.01. 20:13,nan,nan,8,500,nan,nan
https://meeco.kr/?_filter=search&act=&vid=&mid=ITplus&category=&search_target=title_content&search_keyword=에어팟,미니기기코리아,"노캔 헤드폰이 많이보이더라구요 요즘 그래서 좀 봐볼까 하는데 아직도 대세는 애플 - 에어팟 프로 맥스 안드로이드 - 보스 Qc45, 소니 xm4, xm5 이정도인가요?",nan,2022.10.31. 12:02,nan,nan,12,1166,nan,nan
https://meeco.kr/?_filter=search&act=&vid=&mid=ITplus&category=&search_target=title_content&search_keyword=에어팟,미니기기코리아,어쩌다가 에어팟프로가 생겨서 맥북프로에 물려서 쓰고 있는데 유튜브 볼때마다 흠찻흠칫 놀랍니다 분명히 이어폰 꼈는데 왜 소리가 스피커로 나오지 하면서...,nan,2022.10.31. 19:14,nan,nan,2,366,nan,nan
https://meeco.kr/?_filter=search&act=&vid=&mid=ITplus&category=&search_target=title_content&search_keyword=에어팟,미니기기코리아,"국내 소니 엑스페리아가 철수하고 나서... 뭐 사지 뭐 살까 하다가 사과농장을 시작하게 되었죠... 아이폰8 + 에어팟 1세대 + 애플워치 시리즈3로 시작... 지금은 어떠냐구요?... 무럭무럭 자라난.. 사과농장이 되었습니다...? 저기에... 홈팟, 홈팟미니... 각종 악세사리들 하면...어휴... 제가 봐도 답없네요. 소니 엑스페라아가 국내 계속 나왔다면 사과농장은 없지 않았을까 싶긴합니다.",nan,2022.10.29. 22:46,nan,nan,3,788,nan,nan
https://meeco.kr/?_filter=search&act=&vid=&mid=ITplus&category=&search_target=title_content&search_keyword=에어팟,미니기기코리아,3세대 사용중인데 공간음향 켜도 음색말고는 그냥 소리가 앞보다는 중앙으로 좀 몰리고 헤드트래킹 키면 그냥 소리가 중간 살짝앞에 고정되는거 말고는 딱히 잘 모르겠어서요.. 돌비음원을 들어도 애플티비같은데서 지원 영상을봐도 공간감보다는 그냥 음색이 달라지는거 말고는 크게 잘 모르겠던데 혹시 또 프로모델이랑 공간음향 체감차이가 나는건가 궁금하네요 아니면 그냥 기대가 너무 큰걸까요..ㅋㅋㅋ,nan,2022.10.31. 19:51,nan,nan,0,278,nan,nan
https://meeco.kr/?_filter=search&act=&vid=&mid=ITplus&category=&search_target=title_content&search_keyword=에어팟,미니기기코리아,리콜대상제품이라서 2~3주전에 양쪽유닛 교체(리퍼)받았는데 그 시점 이후로 유닛 완충상태에서 케이스 배터리를 빨아먹는 기분이 듭니다. 한 20~30분에 1%씩 줄어들고 있어요. 연결끊어서 삭제하고 다시 설정해도 이러네요. 혹시 동일한 증상 겪으신분 계실까요?,nan,2022.11.02. 18:12,nan,nan,0,154,nan,nan
https://meeco.kr/?_filter=search&act=&vid=&mid=ITplus&category=&search_target=title_content&search_keyword=에어팟,미니기기코리아,걍 첨에 달려있는 m 사이즈 끼고도 잘 맞다고 나오길래 그냥 끼고 다녔더니 자꾸 빠질려고해서 s 로 바꾸니 괜찮군요 버즈프로도 m 잘 맞아서 그냥 에어팟프로도 그냥 썻더니 s 를 진작 쓸걸 그랬습니다 버즈프로 m이 11.5인데 에어팟프로 s가 11.3이였네요 버즈프로 L = 에어팟 프로m 이였군요 ㅋㅋ,nan,2022.11.05. 18:13,nan,nan,2,444,nan,nan
https://meeco.kr/?_filter=search&act=&vid=&mid=ITplus&category=&search_target=title_content&search_keyword=에어팟,미니기기코리아,"혹시 에어팟으로 노래 들으시면서 애플워치 타이머 맞춰놓고, 시간 다되면 노래 그냥 꺼져버리는게 원래 이런건가요..?",nan,2022.11.02. 20:27,nan,nan,2,394,nan,nan
https://meeco.kr/?_filter=search&act=&vid=&mid=ITplus&category=&search_target=title_content&search_keyword=에어팟,미니기기코리아,각인도 연결 화면에 떠서 좋아보인다 싶었는데 혹시 리퍼 같은 걸 하게되면 어떻게 되는 건가요? 리퍼 제품도 각인을 따로 해서 주는 건지... 아니면 그냥 밋밋한 게 오는 건가요?,nan,2022.11.01. 21:22,nan,nan,4,581,nan,nan
https://meeco.kr/?_filter=search&act=&vid=&mid=ITplus&category=&search_target=title_content&search_keyword=에어팟,미니기기코리아,"페이스타임 핸드오프가 아이폰과 아이패드 사이에서 작동합니다. 이런 식으로 알림이 뜨고, 누르면 페이스타임 앱이 실행되면서 전환 여부를 묻는 창이 뜹니다. 잘 작동합니다. 에어팟도 같이 전환되네요.",nan,2022.11.03. 22:06,nan,nan,4,1278,nan,nan
https://meeco.kr/?_filter=search&act=&vid=&mid=ITplus&category=&search_target=title_content&search_keyword=에어팟,미니기기코리아,모두 제가 직접겪었던 이야기입니다.. 예전에 에어팟프로 리콜 떴을때 집근처 공인수리점에 갔었습니다 한 3주쯤 전부터 증상은 나왔었고요.. 그런데 직원이 귀로 들어보고선 문제없다면서 as안된다 이러더라고요..?ㅋㅋ 그래서 계속 얘기를 했는데 결론이 자기가 테스트해볼테니 일주일정도 센터에 맡겨보고 가는건 어떻냐는거였습니다 그래서 일단 맡기고 일주일후에 찾으러 갔더니 그 직원이 테스트해봤는데 증상이 안나타났다라면서 돌려주는데 유닛쪽에 없던 찍힘이 생겨있더라고요.. 그래서 찍힘관련해서 이건 문제있는거 아니냐 했더니 돌아오는말이 사진찍어두셨어요? 맡기기전에 사진찍어두셨나요? 이러더라고요ㅋㅋㅋ....🤬 그뒤로 엄청 말싸움하다가 하는말이 자기는 받고나서 일주일간 꺼내본적도 없다 갑자기 이러는.. 맡겨둔거 꺼내보지도 않았는데 테스트는 어떻게한거고 그 테스트도 자기귀로 해놓고 문제없다에 없던 찍힘도 생겨있고 그와중에 하는말이 사진찍어두셨어요 이래서 진짜 어이가없어서 직급 더높은분 불러달라하고 상황 설명하니 그냥 바로 양쪽 리퍼처리해주셨었습니다... 보기도 싫어서 그뒤로 헐값에 팔아치웠습니다ㅋㅋ 노트20울트라 사용중이었을때는 녹조+불량화소 문제로 센터갔었는데 밝은환경이라 센터에선 바로 보이지도 않았고 하단프레임 약한 찍힘이 있었는데도 묻지도 않으시고 바로 교환해주셨었네요 이런일들 겪고나니깐 메뉴얼도 메뉴얼이지만 직원분의 태도와 마음씨가 더 중요하다는 생각이 들더라고요🥵,nan,2022.11.03. 16:41,nan,nan,1,415,nan,nan
https://meeco.kr/?_filter=search&act=&vid=&mid=ITplus&category=&search_target=title_content&search_keyword=에어팟,미니기기코리아,굉장히 좋게보여요ㅎ.ㅎ 돈많아보이시거든요^^ 완전부럽읍니다 저도 마크5 사고싶어요...,nan,2022.11.01. 22:54,nan,nan,4,1169,nan,nan
https://meeco.kr/?_filter=search&act=&vid=&mid=ITplus&category=&search_target=title_content&search_keyword=에어팟,미니기기코리아,상시 잔량표시 안 되고 24시간 백그라운드에 상주하던 나의찾기도 꺼졌네요. 신기합니다;,nan,2022.11.03. 11:18,nan,nan,2,711,nan,nan
https://meeco.kr/?_filter=search&act=&vid=&mid=ITplus&category=&search_target=title_content&search_keyword=에어팟,미니기기코리아,"제 귀 자체가 자연스럽게 끼면 콩나물 줄기부분이 바닥을 향하게 돼서 그렇게 계속 썼는데, 애플 공식 사진에 나와있는거처럼 줄기부분을 입쪽으로 향하게 착용했더니 훨씬 차음이 잘되고 노캔이 잘되네요. 역시 뭐든지 하라는데로 하는게 맞나봅니다 ㅋㅋㅋ",nan,2022.11.06. 20:54,nan,nan,2,972,nan,nan
https://meeco.kr/?_filter=search&act=&vid=&mid=ITplus&category=&search_target=title_content&search_keyword=에어팟,미니기기코리아,기존에 h910 헤드폰을 쓰다가 서브로 하나 들였습니다. 에어팟맥스는 못사고 닮은꼴 샀는데 주연채널에서 리뷰 보고 좀 걱정했는데 생각보다 괜찮습니다.,nan,2022.11.07. 14:40,nan,nan,0,303,nan,nan
https://meeco.kr/?_filter=search&act=&vid=&mid=ITplus&category=&search_target=title_content&search_keyword=에어팟,미니기기코리아,PNC를 중요시하고 조미료 느낌 나는 자극적인 소리를 좋아해서 팟프로 1세대는 몇번 샀다가 팔았다 했는데 2세대도 리뷰보면 크게 다른건 없을것같지만.. 찍먹 해보기에 나쁘지 않은 가격같아 사봅니다,nan,2022.11.06. 23:54,nan,nan,3,438,nan,nan
https://meeco.kr/?_filter=search&act=&vid=&mid=ITplus&category=&search_target=title_content&search_keyword=에어팟,미니기기코리아,,nan,2022.10.05. 20:23,nan,nan,5,699,nan,nan
https://meeco.kr/?_filter=search&act=&vid=&mid=ITplus&category=&search_target=title_content&search_keyword=에어팟,미니기기코리아,다음주에는 출시할 줄 알았더니...,nan,2022.10.05. 12:07,nan,nan,2,399,nan,nan
https://meeco.kr/?_filter=search&act=&vid=&mid=ITplus&category=&search_target=title_content&search_keyword=에어팟,미니기기코리아,"애플은 2020년 아이폰 생산의 일부를 중국에서 인도로 이전할 수 있으며 현재 에어팟과 비트도 같은 계획을 세우고 있다. 닛케이에 따르면 쿠퍼티노 업체는 이미 2023년 3월 말까지 수출을 두 배로 늘리는 것을 목표로 공급업체에 남아시아 국가로 생산을 이전할 것을 요청했다. 블룸버그통신은 이번주 초 인도에서 생산돼 유럽과 중동으로 출하된 아이폰이 10억 달러의 비용과 같으며, 새로운 움직임으로 2023년 3월까지 이 숫자가 25억 달러에 이를 수 있다고 보도했다. 분석가들은 인도로의 전환이 좋은 일이라고 믿고 있습니다... 기사 더 읽기",nan,2022.10.06. 03:40,nan,nan,0,107,nan,nan
https://meeco.kr/?_filter=search&act=&vid=&mid=ITplus&category=&search_target=title_content&search_keyword=에어팟,미니기기코리아,오늘 일정 나온다고 봤었는데 아닌건지 아직도 없네요 얼른 내놔!!!!!!!!!!!!!!!!!!!!!!!!!!!!!,nan,2022.10.05. 18:24,nan,nan,4,156,nan,nan
https://meeco.kr/?_filter=search&act=&vid=&mid=ITplus&category=&search_target=title_content&search_keyword=에어팟,미니기기코리아,품절상태로 판매페이지 만들어졌길래 0시에 오픈하는줄 알았더만... 안열리네요. 하이마트 루머대로 아침 9시에 판매 시작인가봅니다..,nan,2022.10.06. 00:05,nan,nan,4,412,nan,nan
https://meeco.kr/?_filter=search&act=&vid=&mid=ITplus&category=&search_target=title_content&search_keyword=에어팟,미니기기코리아,와우 8퍼 할인 있네요. 바로 구매했읍니다. 근데 21일 배송이네요...,nan,2022.10.06. 09:01,nan,nan,2,228,nan,nan
https://meeco.kr/?_filter=search&act=&vid=&mid=ITplus&category=&search_target=title_content&search_keyword=에어팟,미니기기코리아,https://www.coupang.com/vp/products/6790570821?vendorItemId=83202423254 달리세요.,nan,2022.10.06. 09:03,nan,nan,1,151,nan,nan
https://meeco.kr/?_filter=search&act=&vid=&mid=ITplus&category=&search_target=title_content&search_keyword=에어팟,미니기기코리아,"기사내용 요약 일상비일상의틈에서 아이폰14 관련 팝업 진행 전용 제휴카드로 할부 구매 시 통신 요금 할인 [서울=뉴시스] LG유플러스가 아이폰14 시리즈 판매 확대를 위해 애플워치, 에어팟, 한정판 굿즈 등의 경품을 증정하는 이벤트를 한다. (사진=LGU+ 제공) 2022.10.7 *재판매 및 DB 금지 [서울=뉴시스]심지혜 기자 = LG유플러스는 아이폰14 시리즈 판매 확대를 위해 애플워치, 에어팟, 한정판 굿즈 등의 경품을 증정하는 이벤트를 한다고 7일 밝혔다. 우선 이달 30일까지 '일상비일상의틈'에서 팝업 행사를 한다. 틈에는 아이폰14 체험존과 설문조사 후 무료 사진 촬영을 할 수 있는 공간을 마련했다. 체험과 설문을 모두 마치면 추첨을 통해 애플워치 울트라를 증정한다. (하략)",nan,2022.10.07. 11:23,nan,nan,0,125,nan,nan
https://meeco.kr/?_filter=search&act=&vid=&mid=ITplus&category=&search_target=title_content&search_keyword=에어팟,미니기기코리아,이게 고민이 되네요 가격이 아이폰꺼보다 싸니까 들만 할거 같기도 하구요,nan,2022.10.06. 12:58,nan,nan,7,366,nan,nan
https://meeco.kr/?_filter=search&act=&vid=&mid=ITplus&category=&search_target=title_content&search_keyword=에어팟,미니기기코리아,흐음 굉장히 고민중이네여... 리퍼받은지 한달정도 지났는데...,nan,2022.10.06. 14:24,nan,nan,7,321,nan,nan
