url,site,document,documenttype,postdate,likes,dislike,comment_cnt,views,boardcategory,documentcategory
https://meeco.kr/?_filter=search&act=&vid=&mid=ITplus&category=&search_target=title_content&search_keyword=에어팟,미니기기코리아,"여러 이어폰을 써왔지만 이렇게까지 무난한 이어폰은 처음이네요 에어팟 프로는 그당시 미친수준의노캔를 보여줬고, 버즈 라이브는 편한 착용감, wf 1000xm4는 ldac와 헤드폰에 도전하는 수준의 노캔을 보여줬지만 버즈2프로는 저한테 보여준게 없는것 같습니다. 죄책감없이 보스로 기변할수 있겠군요",nan,2022.10.13. 10:25,nan,nan,14,1404,nan,nan
https://meeco.kr/?_filter=search&act=&vid=&mid=ITplus&category=&search_target=title_content&search_keyword=에어팟,미니기기코리아,출근하고 좀 시간 남아서 각종 이어폰 커뮤니티 돌아보니까 션 올리브라는 박사님이 트위터에 에어팟 프로 2세대 극찬을;;;;;;;;; 게다가 사진 뒤에 QC 이어버드 2 떡하니 있네요. ㅋㅋㅋㅋㅋ 이게 뭔 코미디인지;;; 에어팟이면 하만 타겟하고 거리가 멀다는데 물론 내용에 애플 에코시스템이면 더 좋다 라고 적혀있는데 이걸 하만 대표가 적었다는 게 코미디 같네요. ㅋㅋㅋㅋㅋㅋㅋㅋㅋㅋㅋ,nan,2022.10.13. 10:31,nan,nan,12,967,nan,nan
https://meeco.kr/?_filter=search&act=&vid=&mid=ITplus&category=&search_target=title_content&search_keyword=에어팟,미니기기코리아,"에어팟프로2는 31만원에 예약 구매 해놓은 상태이고, 현재 맥세이프 에어팟프로 사용하고 있는 상태입니다. 그저께 애플스토어 가서 에어팟맥스 소리 들었다가 귀를 버리고 왔는데 50만원이 넘는 금액을 주고 중고 에어팟맥스를 구매하는 것이 맞는가에 대한 생각이 드네요. 곧 신형이 나올 것 같기도 하고 긴가민가합니다. 그렇다고 헤드셋에 80만원 쓰기에는 조금 그렇고.. 어떤게 나은 선택인지 모르겠네요 소리는 XM5가 확실히 좋은데, 디자인이 별로라 에어팟맥스 스그가 아른거리네요..",nan,2022.10.13. 15:12,nan,nan,10,723,nan,nan
https://meeco.kr/?_filter=search&act=&vid=&mid=ITplus&category=&search_target=title_content&search_keyword=에어팟,미니기기코리아,에어팟 맥스는 안그런데 에어팟프로 2세대 연결하면 유튜브에서 10초넘길때마다 딜레이걸리거나 영상이ㅜ멈추네요... 저만 그런건지.. 다른분도 그런건지...,nan,2022.10.13. 19:38,nan,nan,3,348,nan,nan
https://meeco.kr/?_filter=search&act=&vid=&mid=ITplus&category=&search_target=title_content&search_keyword=에어팟,미니기기코리아,"영디비, 언더케이지등 리뷰어들이 극찬을 하는 리뷰들 보다가 아레지나 라는 유투버 영상을 보았습니다. 화노도 그렇고 딜레이도 에어팟이나 버즈에 비해 심하던데 그걸 언급하더군요. (극찬하는 유투버들은 어영부영 넘어가던데..) 그리고 다른 리뷰들 보면 스마트폰이랑 연결성이 그리 좋은거 같진 않아보여서요. 음질이나 노캔이야 확실히 좋은것 같은데 위 단점들이 실제로 체감이 많이 되는지 궁금합니다. 현재 아이폰에 버즈2 물려 사용중인데 예전 갤럭시폰들이랑은 버즈2 연결성이 괜찬았는데 아이폰에서 쓰니까 연결성이 좀 떨어지는거 같은건 체감을 하고 있거든요..",nan,2022.10.15. 10:49,nan,nan,3,696,nan,nan
https://meeco.kr/?_filter=search&act=&vid=&mid=ITplus&category=&search_target=title_content&search_keyword=에어팟,미니기기코리아,>2022년 9월 23일에 발매된 Apple의 노이즈 캔슬링 무선 이어폰 AirPods Pro2 모델이 좌우의 음성이 바뀌거나 동영상과의 동기화가 어긋나거나 하는 오디오 드리프트 의 불량 이슈가 나왔습니다. ​ 한편 >9to5mac에 따르면 Apple은 2세대 AirPods Pro에서 오디오 드리프트가 일어난다는 문제를 인정하지 않았다고 합니다.,nan,2022.10.14. 22:37,nan,nan,0,466,nan,nan
https://meeco.kr/?_filter=search&act=&vid=&mid=ITplus&category=&search_target=title_content&search_keyword=에어팟,미니기기코리아,에어팟2만 쓰다가 이번에 고장나서 바꾸려고 하는데 에어팟 프로2세대는 가격이 비싸서 버즈2프로를 고려해보고 있습니다 문제는 SSC 코덱이 갤럭시 전용이라 아이폰에서는 100% 성능이 안나올것 같아서 걱정입니다 적당히 체감이 크지 않으면 구매할까 하는데 어떨까요?,nan,2022.10.16. 20:12,nan,nan,4,437,nan,nan
https://meeco.kr/?_filter=search&act=&vid=&mid=ITplus&category=&search_target=title_content&search_keyword=에어팟,미니기기코리아,막 비싼 헤드폰이 필요 없을수도 있겠군요 저는 음악 취향이 클래식 or 애니음악(럽라 같은) 극단적인 취향이라 저 둘만 듣거든요 그런 와중에 오랜만에 매장 와서 30~40만원대부터 에어팟 맥스 등등 이런저런 헤드셋들 체험중인데 클래식 음악이나 좀 풍성한 팝 음악에선 충분히 체감되는데 뭐랄까 애니 음악 (대표적으로 러브라이브) 같은 음원들은 큰 차이가 없네요 클래식 음악이 라지 사이즈 피자라서 tws같은 조그마한 그릇에 못 담는 느낌이라면 애니음악은 조각피자 느낌이라 작은 그릇으로도 충분히 커버되는 느낌이랄까요 이거 신기하네요 ㅋㅋㅋ,nan,2022.10.16. 10:16,nan,nan,7,368,nan,nan
https://meeco.kr/?_filter=search&act=&vid=&mid=ITplus&category=&search_target=title_content&search_keyword=에어팟,미니기기코리아,약 3시간정도 써봤습니다. 1. 화이트노이즈관련 : 화이트 노이즈가 있긴있습니다. 하지만 이 노이즈는 고요한 제방에서 음악끄고 집중해야 겨우 들리는수준이며 볼륨10정도로 음악틀기만해도 화노 못느꼈습니다. 2. 착용감 : 편한정도가 버즈2프로또는 에어팟 프로랑 동급수준입니다. 편하고 귀에 착착감깁니다. 3. 음질 : 보스 특유의 저음위주 세팅이 많이 죽어서 좋게말하면 밸런스있고 나쁘게말하면 평범합니다. 4. 노이즈 캔슬링 : 미친수준입니다. 이거끼고 압구정역 대로를 걸어봤는데 정말 놀라운 수준으로 소음을 삭제시켜줍니다. 일단은 이정도로 정리했습니다. 궁금한거 있으시면 댓글로 달아주시면 답변해드리겠습니다.,nan,2022.10.14. 20:07,nan,nan,5,390,nan,nan
https://meeco.kr/?_filter=search&act=&vid=&mid=ITplus&category=&search_target=title_content&search_keyword=에어팟,미니기기코리아,예전에 에어팟 3세대 + 팟프로 (맥세이프) 모델 했던거 보면 +14만원 쯤으로 에어팟 프로 2세대 매물이 나올거라고 생각하는데... 존버할까 생각중입니다. 1000XM4 슬슬 배터리가 메롱해지려는데 다시 에어팟회귀라니 리콜 직전에 빡쳐서 팔았던 적 있었는데 아이러니하군요,nan,2022.10.14. 14:09,nan,nan,1,263,nan,nan
https://meeco.kr/?_filter=search&act=&vid=&mid=ITplus&category=&search_target=title_content&search_keyword=에어팟,미니기기코리아,오늘 소니 섭센가서 무상교체 받고 왔습니다 보증기간 1년도 새로 시작한다고 하던데 그래서 고민입니다 팟프로2 예구한 것을 취소하고 xm4를 사용할지 xm4를 미개봉으로 팔고 팟프로2를 쓸지 말입니다 폰은 아이폰 13프맥입니다,nan,2022.10.17. 16:32,nan,nan,8,483,nan,nan
https://meeco.kr/?_filter=search&act=&vid=&mid=ITplus&category=&search_target=title_content&search_keyword=에어팟,미니기기코리아,"블룸버그의 마크 거먼은 최근 뉴스레터에서 애플이 M2 칩을 탑재한 두 개의 새로운 아이패드 프로 태블릿을 ""수일 내로"" 발표할 것이라고 말했다.저널리스트에 따르면, 11인치와 12.9인치 기기는 약간의 업그레이드가 될 것이며 새로운 충전 기능을 가질 수 있을 것이라고 한다. 아이패드 프로는 애플이 분기 및 연간 수익을 발표하는 10월 27일 이전에 출시될 것으로 예상된다.그러나 출시 예정은 없으며 태블릿은 회사 웹사이트에 보도 자료와 함께 발표될 예정이다. 새로운 아이패드 프로는 Mag Safe 충전 기능을 제공할 수 있으며, 구르만은 심지어 태블릿이 아이폰이나 에어팟 케이스와 배터리를 공유할 수 있도록 역무선 충전을 제안하기도 했다.우리는 또한 보통 iOS와 함께 출시되는 소프트웨어 업데이트인 iPadOS 16의 출시를 보게 될 것이다. 거먼에 따르면, 애플 워치 울트라의 재고 부족은 기기 자체가 아니라 밴드에 의해 발생한다고 한다.노란색이나 파란색의 트레일 루프는 오렌지색 알파인 루프를 찾기가 매우 어렵습니다.이로 인해 현재 Watch Ultra 출하가 11월 첫째 주로 앞당겨지고 있으며 일부 모델은 이보다 더 늦게 입고되고 있습니다. 기사 더 읽기",nan,2022.10.17. 18:56,nan,nan,0,210,nan,nan
https://meeco.kr/?_filter=search&act=&vid=&mid=ITplus&category=&search_target=title_content&search_keyword=에어팟,미니기기코리아,야호 너무 좋습니다,nan,2022.10.19. 14:25,nan,nan,2,342,nan,nan
https://meeco.kr/?_filter=search&act=&vid=&mid=ITplus&category=&search_target=title_content&search_keyword=에어팟,미니기기코리아,프로1세대 사용 어느덧 2년반을 꽉 채워 넘기고 에어팟프로2세대 넘어갈까말까 드릉드릉 하던차입니다. 근래 음감할때 뭔지모를 밋밋함이 느껴져서 맞춤형 음향 초기화하고 처음부터 세팅하니까 다시 처음 느꼈던 음향대로 돌아온 기분입니다. 오랜 사용으로 안쪽 그릴도 꽤 막혀있고 주변음듣기에서도 이제는 일반 커널형처럼 압이 느껴지는데 그래서 소리도 알게모르게 좀 다르게 들렸었나봅니다. 현재 상태에 맞게 재조절되는 느낌을 받게되니 뭔가 좋네요. 는 개뿔 배터리 살살 녹,nan,2022.10.17. 23:21,nan,nan,4,361,nan,nan
https://meeco.kr/?_filter=search&act=&vid=&mid=ITplus&category=&search_target=title_content&search_keyword=에어팟,미니기기코리아,삼성 anc c타입 이어폰입니다 예전에 삼성 이벤트몰에서 5만원인가에 집어온건데 아무래도 유선이라 들고 다니면서 사용하기엔 불편해서 집에서 놋북에 연결해서만 쓰고 있었는데 오늘 마침 시간이 나서 에어팟 프로랑 비교해봤는데 어우 소리 자체가 다르군요 개인적으로 버즈2 프로랑 비교해서도 소리는 이쪽이 나은것 같은데 무선 이어폰이 좋아지고는 있다지만 가격 대비 소리는 역시 유선이군여,nan,2022.10.18. 16:21,nan,nan,13,815,nan,nan
https://meeco.kr/?_filter=search&act=&vid=&mid=ITplus&category=&search_target=title_content&search_keyword=에어팟,미니기기코리아,"결국에는 별도의 충전기 없이도 아이패드만으로 충전할 수 있게 만든 결과물 아니었나요? 그 원칙도 이번엔 온데간데없고, 이젠 저 어댑터 없으면 충전도 못하겠네요; 전의 아이패드들은 그래도 즉시 충전이라도 가능했지... 3.5mm 오디오잭이 사라졌을 때는 에어팟을 사면 해결이라도 되었지만 저건 뭐 해결의 여지도 없군요ㅋㅋㅋㅋ 최소한 꽁무니 충전단자가 Type C인 애플펜슬1.5를 만들었어야 한다고 생각합니다.",nan,2022.10.19. 08:32,nan,nan,9,658,nan,nan
https://meeco.kr/?_filter=search&act=&vid=&mid=ITplus&category=&search_target=title_content&search_keyword=에어팟,미니기기코리아,톤프리 T90 한달동안 사용해보니 동글기능때문에 가지고 노는 맛이 있네요. 동글기능으로 여기저기 아날로그 기기에 연결해 해보면서 사용하니 좋습니다. 트래드밀 앞 TV에 연결하니 유선사용시 불편함도 없고 데스트탑에 블루투스가 없어서 영상 볼 생각도 안했는데 21인치 모니터로 보니 재미가 납니다 TV에 연결하여 돌비애트모스 보니 영화관에서 보는 느낌도 나구요. 동글이 aptx adaptive코덱을 지원하여 음질도 좋고 레이턴시도 느끼지 못할 정도로 좋습니다. 펌웨어 업데이트로 음질도 선명하게 더 개선되었고. 11mm 드라이버여서 인지 베이스가 짱짱합니다. 다소 부족한 anc 성능도 좋아져서 에어팟프로 수준은 아니더라고 만족스럽니다. T90의 가장 핫한 돌비애트모스와 돌비헤드트레킹도 TWS치고는 상당히 효과적입니다. 에어팟스러운 모양새지만 뛰어난 착용감과 UV나노로 인해 알콜로 닦아주거나 하는 불편함도 없어서 좋습니다. 멀티포인트로 갤럭시폰과 아이패드 동시에 연동하니 상당히 편리한게 만족스럽습니다. 헬지가 전혀 광고를 안하니 잘 알려지지 않아서 에어팟짝퉁 소리 듣는 것 외에는 불만이 없습니다. 착용감이나 음질 등 편의사양 원하시는 분들은 베스트샵에서 청음해보시기 바랍니다.,nan,2022.10.19. 07:29,nan,nan,8,497,nan,nan
https://meeco.kr/?_filter=search&act=&vid=&mid=ITplus&category=&search_target=title_content&search_keyword=에어팟,미니기기코리아,"일본곡도 좀 듣고 그러는데 스포티파이 큐레이션 기능이 좋다고 하네요? 음질은 어떻나요? 사과 농장 소유중입니다. (아이폰, 아이패드, 에어팟 프로)",nan,2022.10.19. 17:11,nan,nan,10,434,nan,nan
https://meeco.kr/?_filter=search&act=&vid=&mid=ITplus&category=&search_target=title_content&search_keyword=에어팟,미니기기코리아,빨리 도착하길...,nan,2022.10.20. 08:32,nan,nan,0,159,nan,nan
https://meeco.kr/?_filter=search&act=&vid=&mid=ITplus&category=&search_target=title_content&search_keyword=에어팟,미니기기코리아,사전예약 당일에 오후1시쯤 주문했으니 밀리진 않을거같은데 웰케 늦는지 ㅠ 운송장은 떳는데 제품은 택배사 도착전이네요 ㅠ 그나저나 cj로 올줄알았는데 한진택배 네요?,nan,2022.10.20. 18:36,nan,nan,1,106,nan,nan
https://meeco.kr/?_filter=search&act=&vid=&mid=ITplus&category=&search_target=title_content&search_keyword=에어팟,미니기기코리아,네이버에서 예약하신 분들 확인해보세요,nan,2022.10.20. 19:23,nan,nan,4,255,nan,nan
https://meeco.kr/?_filter=search&act=&vid=&mid=ITplus&category=&search_target=title_content&search_keyword=에어팟,미니기기코리아,하지만 오늘 지방출장가서 토요일날 집에 옵니다 흑흑ㅠ,nan,2022.10.20. 20:36,nan,nan,2,184,nan,nan
https://meeco.kr/?_filter=search&act=&vid=&mid=ITplus&category=&search_target=title_content&search_keyword=에어팟,미니기기코리아,움직여!!!!!!! 조금만 더 힘을내!!!!!! 빨리 쓰고 싶습니다. 에어팟 프로1은 정말 3년 꽉채워서 잘썼네요.,nan,2022.10.21. 11:47,nan,nan,1,260,nan,nan
https://meeco.kr/?_filter=search&act=&vid=&mid=ITplus&category=&search_target=title_content&search_keyword=에어팟,미니기기코리아,에어팟프로 아직도 출발안하고 있네요 커뮤니티 둘러봐도 다 이런 분위기고.. 아이폰은 오전에 칼이였는대 이럴거면 네이버에서 싸게살걸 그랬어요,nan,2022.10.21. 00:39,nan,nan,2,555,nan,nan
https://meeco.kr/?_filter=search&act=&vid=&mid=ITplus&category=&search_target=title_content&search_keyword=에어팟,미니기기코리아,픽업열려있네요. 다만 정가구매이고 14일내 교환/환불 정책적용됩니다. 현장 제품 구매시 각인서비스 미제공입니다. 공인판매점은 예판분아니면 10월중순까지 판매되지 않거나 아니면 아예 판매중지하였습니다. 빠르게 손에 넣으시려면 현재로써는 미개봉 구하시거나 애플리테일 가시는게 빠를듯 합니다.,nan,2022.10.21. 10:32,nan,nan,0,218,nan,nan
https://meeco.kr/?_filter=search&act=&vid=&mid=ITplus&category=&search_target=title_content&search_keyword=에어팟,미니기기코리아,음질은 진짜 이게 코드리스가 맞나 싶긴 할 정도로 좋은데 사운드 드리프트 문제가 너무 심각해서 어지러움 까지 느낄 정도네요. 일단 버스 안에서 계속해서 음상이 뒤짚힙니다. 1분에 몇번씩 그러는지도 못 셀 정도로 너무 심각해서 공간감 오디오 킨 것도 아닌데 무슨 파도치듯이 왼쪽으로 쏠렸다가 오른쪽으로 쏠렸다가 아주 지멋대로 왔다갔다 너무 심각해서 짜증날 지경이네요. ㅋㅋㅋ 직구한 거라 아직 AS도 안될텐데...; 지금 사실 분들은 다시 한 번 생각해보시길 바랍니다.,nan,2022.10.21. 09:47,nan,nan,4,532,nan,nan
https://meeco.kr/?_filter=search&act=&vid=&mid=ITplus&category=&search_target=title_content&search_keyword=에어팟,미니기기코리아,이제서야...,nan,2022.10.21. 09:22,nan,nan,2,157,nan,nan
https://meeco.kr/?_filter=search&act=&vid=&mid=ITplus&category=&search_target=title_content&search_keyword=에어팟,미니기기코리아,한 30분정도 써봤는데 무난하면서 좋네요 노캔은 확실히 좋아졌네요 다들 극찬할만 합니다. 저음도 체감갈정도라 만족스럽고 다만 케이스랑 유닛은 변한게 거의 없으니 먼가 새제품 산 느낌은 안들었습니다. 그나마 좋았던점은 옛날 케이스 그대로 사용 가능해서 한동안은 쓰던거 그냥 쓸 수 있고 좋네요 히히,nan,2022.10.21. 14:58,nan,nan,2,205,nan,nan
https://meeco.kr/?_filter=search&act=&vid=&mid=ITplus&category=&search_target=title_content&search_keyword=에어팟,미니기기코리아,1. 1세대 대비 특별한거 X 2. 저음 증가 체감은 가능 3. 케이스 소리나는거 감성 돋 😩😩😩,nan,2022.10.21. 14:20,nan,nan,6,396,nan,nan
https://meeco.kr/?_filter=search&act=&vid=&mid=ITplus&category=&search_target=title_content&search_keyword=에어팟,미니기기코리아,프로1은 노캔 키고 잘 돌아다녔는데 프로2는 자동차 엔진 배기음 같은것들 잘 들리지가 않습니다 ㄷㄷ 이거 키고 멍때리고 다니다간 진짜 사고날지도요. 주변음허용 써야겠어요 ㅠㅠ,nan,2022.10.21. 16:14,nan,nan,2,385,nan,nan
https://meeco.kr/?_filter=search&act=&vid=&mid=ITplus&category=&search_target=title_content&search_keyword=에어팟,미니기기코리아,아니 아직도 라이트닝단자라니... C타입으로 기대하고 있었는데 말이죠 연동성은 좋은데 잠깐 꽂고 한거로는 평가를 아직 못 내리겠습니다,nan,2022.10.21. 17:10,nan,nan,0,132,nan,nan
https://meeco.kr/?_filter=search&act=&vid=&mid=ITplus&category=&search_target=title_content&search_keyword=에어팟,미니기기코리아,"프로1,2 둘 다 스몰사이즈 이어팁 쓰는데 이어팁이 더 귓구멍에 꽉 차는 느낌이네요. 이게 노캔향상에 더 영향을 주는것고 같은데요. 저만 이렇게 느끼는 걸까요?",nan,2022.10.21. 18:08,nan,nan,9,313,nan,nan
https://meeco.kr/?_filter=search&act=&vid=&mid=ITplus&category=&search_target=title_content&search_keyword=에어팟,미니기기코리아,"좌우 사운드, 노캔이 마음대로 요동치고 난동을 부립니다 신박하네요",nan,2022.10.21. 20:50,nan,nan,4,496,nan,nan
https://meeco.kr/?_filter=search&act=&vid=&mid=ITplus&category=&search_target=title_content&search_keyword=에어팟,미니기기코리아,"기대를 너무 크게 했나봐요 사실 저는 노캔보다 음질 개선을 바랬는데 음질, 노캔 등 모든 부분에서 개선은 있지만 혁신적이거나 놀랍거나 거대한 변화는 없습니다 언더케이지가 에어팔 프로 2세대 영상에서 엄청 액션을 크게 했는데 오버액션 같네요 그냥 저음 살짝 좋아지고 노캔 좀 더 강해지고 짧은 사용기입니다",nan,2022.10.21. 17:45,nan,nan,2,345,nan,nan
https://meeco.kr/?_filter=search&act=&vid=&mid=ITplus&category=&search_target=title_content&search_keyword=에어팟,미니기기코리아,1세대는 박스에 오른쪽 유닛만 두개 그려져 있었습니다. 서로 마주보는 듯한 구도를 취하고 있었죠. 그런데 2세대는 왼쪽 유닛 오른쪽 유닛 하나씩 서로 같은 방향을 보고 있도록 변경되었습니다. 박스만으로 세대를 구분하기 위함일까요? 그리고 어째서인지 프로 1세대를 따라해서 박스에 오른쪽 유닛 2개만 그려져있는 LG 톤프리... (...),nan,2022.10.21. 18:39,nan,nan,1,369,nan,nan
https://meeco.kr/?_filter=search&act=&vid=&mid=ITplus&category=&search_target=title_content&search_keyword=에어팟,미니기기코리아,"버즈프로에도 스핀핏 써서 귀가 아프진 않았는데, 에어팟 프로 2로 오랜만에 타원형 맛 보니깐 귓구녕이 얼얼하네요 ㅋㅋㅋㅋ 아즈라 맥스야 빨리와 ㅠㅠ",nan,2022.10.21. 22:19,nan,nan,0,230,nan,nan
https://meeco.kr/?_filter=search&act=&vid=&mid=ITplus&category=&search_target=title_content&search_keyword=에어팟,미니기기코리아,"애플 뮤직에서 돌비 에트모스 끔 + 스테레오 공간화 활성화 + 개인 맞춤형 공간 음향 상태로 주로 청음했습니다. (개인적으로는 이렇게가 좋은 것 같아요/ 돌비 에트모스 음원에다가 스테레오 공간화는 너무 음량도 많이 먹고, 소리를 너무 멀리 떨어트려놓다고나 할까요) 개인적으로는 에어팟 3세대가 제 음색취향에는 맞았습니다. 그래도 프로 1세대보다는 좋아진게 느껴졌지만, 좀 더 좋은 음질로 내주었으면 하는 바램이 있네요 일반인이 듣기에는 크게 문제가 될 거 같지는 않을것 같습니다. 개인적으로 가장 큰 혁신(?)은 애플워치 충전기로도 충전이 되는걸 꼽고 싶습니다. 유선 충전 포트는 라이트닝 포트인게 킹받지만, 맥세이프로도 애플워치 충전기로도 충전기 되는 건 칭찬해주고 싶네요 통화품질은 아직 지하철에서는 해보지 않았지만, 평타 이상은 해주는 것 같습니다. 노이즈캔슬링은 좋네요. 제가 다른 노캔달린 건 프로 1세대 밖에 안써봐서 모르지만 만족합니다. (오디오 드리프트 현상?은 저도 있는 것 같네요... 빨리 패치 해줬으면) 유닛에서 볼륨조절되는거는 손에 좀 익어야 할 거 같습니다. 폰에서 조절하는게 익숙해져서... 결론은 어디 하나 특출나지 않지만, 기본기가 잘 되어있네요. 그간 중저가형 코드리스들 여럿 써봤지만 가장 마음에 듭니다. 에어팟 다음세대 나올때 까지는 메인으로 계속 쓸 것 같네요 에어팟 1/2, 프로(1세대) 유저들은 넘어가셔도 좋습니다. (가격 떨어지고 가면 더 좋고요) 3세대 유저는 노캔이 필요한게 아니면, 굳이 싶습니다. (3세대 좋은데, 귀에 안맞아서 팔았네요 ㅠㅠ) iOS 유저들에게는 최고의 선택지가 되겠네요",nan,2022.10.21. 22:33,nan,nan,3,457,nan,nan
https://meeco.kr/?_filter=search&act=&vid=&mid=ITplus&category=&search_target=title_content&search_keyword=에어팟,미니기기코리아,퇴근하고 집 들어와서 배송온거 들어봤는데 에어팟 2세대 쓰다가 프로2로 와보니 꽤 많이 달라졌네요. 확실히 주변음허용모드 이거 진짜 신기하고 노캔도 좋네요 반면 공간음향.스테레오공간화 돌비애트모스까지 막 그렇게 좋은 느낌은 안 들었고. 궁극적으로 위의 세가지 제대로 쓰려면 스테이징이 커야 의미가 있다고 생각하는데 스테이징이 많이 작습니다. 스테이징 자체는 에어팟2가 더 낫다는 생각도 들구요 막 음감측면에서 엄청 업그레이드다 이런느낌이 아니라는게... 좀 많이 아쉽네요 다만 저는 ie800으로 음악 들었을때도 스테이징이 엄청 작다고 생각했어서 좀 커널형하고 상극인가? 생각도 들구요 기본적인 해상력이나 저음강화는 맘에듭니다 쨋든 노캔이나 에어팟 특유의 아이폰과의 편의성때문에 어차피 샀을거긴 한데 막 엄청 대단하고 그정도는 아니네요 주변음듣기는.진짜 신기하고.대단하긴합니다,nan,2022.10.21. 22:52,nan,nan,3,586,nan,nan
https://meeco.kr/?_filter=search&act=&vid=&mid=ITplus&category=&search_target=title_content&search_keyword=에어팟,미니기기코리아,소니 WF-1000Xm4를 사용 후에 귀에서 빼면 좀 먹먹한 느낌이 들었는데 프로2는 적게 느껴지거나 안 느껴져서 좋네요. 장착감은 xm4가 개인적으론 착용감이 더 좋은데 프로2는 이어팁이 라지로 바꿔서 귀안쪽은 괜찮긴한데 착용감은 보통이네요,nan,2022.10.22. 12:24,nan,nan,0,261,nan,nan
https://meeco.kr/?_filter=search&act=&vid=&mid=ITplus&category=&search_target=title_content&search_keyword=에어팟,미니기기코리아,"에어팟프로만 벌써 2년 사이에 3대째네요. 에어팟프로 - 맥세이프 에어팟프로 - 에어팟프로2 사실 에어팟프로1이랑 에어팟프로2랑 큰 차이는 안느껴지는데 노캔이 더 좋아진 것 같고, 저음부가 조금 더 깔끔해지고 해상력이 조금 더 좋아진 느낌입니다. 근데 프로1에 비해 우와 수준은 절대 아니고 조금 개선됐네.. 이런 느낌입니다. 근데 케이스에 스피커 추가된건 좋은거 같아요.",nan,2022.10.22. 13:39,nan,nan,0,228,nan,nan
