url,site,document,documenttype,postdate,likes,dislike,comment_cnt,views,boardcategory,documentcategory
https://www.clien.net/service/search?q=기가지니,클리앙,"5일 정보기술(IT)업계에 따르면 KT는 최근 아마존의 AI 음성인식 동맹 ‘음성 상호운용 이니셔티브(VII)’에 합류해 관련 기술 공동연구를 하고 있다. KT 기가지니에서 아마존 알렉사를 쓸 수 있도록 하기 위해서다. VII는 한 AI 기기를 통해 알렉사 등 여러 음성인식 AI 서비스를 통합 구현하는 것을 목표로 한다. 기기 하나에 서로 다른 AI 두뇌 두 개 이상을 넣는 식이다. 기가지니와 알렉사처럼 서로 다른 언어 기반 AI 플랫폼을 한 기기에서 함께 운용하면 서비스 영역이 획기적으로 커질 수 있다. 인식하는 명령어가 그만큼 급증해서다. 현재 기가지니는 영어를, 알렉사는 한국어 음성인식을 지원하지 않는다. 
    이번 협업이 완료되면 기가지니를 통해 한국어와 영어 기반 서비스를 모두 이용할 수 있게 된다. 사용자가 ‘지니야’ ‘알렉사’ 등 명령어를 골라 원하는 AI 플랫폼을 호출하면 된다. 영어를 많이 쓰는 비즈니스 상황에선 ‘알렉사’를 부르는 식이다. 연동되는 기기도 늘어난다. 알렉사는 구글의 사물인터넷(IoT) 기반 스마트홈 브랜드 ‘네스트’ 등과 기기 연동을 지원하고 있다. 
    양사는 VII를 통해 양측 음성인식 AI 빅데이터를 공유하고 플랫폼 호환성을 높일 계획이다. 아마존 관계자는 “이용자가 자신의 필요에 가장 잘 맞는 음성 AI 서비스를 쓰도록 선택권을 주는 게 목표”라고 설명했다. 2019년 9월 기업 30곳이 모여 출범한 VII의 지난달 말 기준 회원사 규모는 92곳이다. 마이크로소프트(MS), 페이스북, 인텔 등 글로벌 IT 기업을 비롯해 독일 가전기업 보쉬, BMW 등 각 분야 회사가 참여한다.",,2021-09-06 08:51:10,1,,5,"4,070",새로운소식,
https://www.clien.net/service/search?q=기가지니,클리앙,"(사진은 라파 카고 빕숏임다) 자전거 시장에 중국 제품 없는거 찾기가 정말 힘들죵 자전거 캠핑용 풀셋트까지 나오는거 보믄... 성능, 기능성 약간 포기하면 정말 싼 가격에서  중국 제품들로만 자전거 용품들 구성이 가능하게 된 시점이긴 함다 그 중에 의류쪽은 언제 쯤 중국 업체들이 따라오려나 했거덩여 자전거 입문하시는 분들이라면 한번쯤 구매해보셨을듯한  중국산 빕숏.....ㅋㅋㅋㅋㅋㅋ 정말 퀄 구리고 패드도 구리고... 진짜 별로였져  몇번 입고 버리는 제품이였슴다 중국산 빕숏으로 돈 버리고 가격 좀 더 나가는 국산 빕숏 구매해서 신세계를 경험하는 그런 레파토리가 흔했는데... 근데 이게 옛 말이 되어가고 있는듯 함다  얘내들이 그냥 치트키를 써버렸네여 패드 기술을 더 발전시키려고 하는거와 동시에 아예 이탈리아 유명한 업체인 엘라스틱 인터페이스 사의 패드를 가저다가 써버리고 있네여ㄷㄷㄷㄷㄷㄷㄷㄷㄷ 얘내들 마케팅 포인트가  한국산 라이크라 원단, (국뽕이 ㅋㅋㅋㅋ) 엘라스틱 인터페이스 패드,  카고 빕숏(주머니 4개 ) 이런데 가격은 라파 카고 빕숏에 6분에 1이더라구요  주변에서 괜찮다는 평이 있길래 저두 하나 사봤숨돠  진짜 받아 보고 놀란게  가성비 빕숏이라고 소문난 dhb꺼 보다 훨씬 더 저렴한데  주머니까지 있으니.... 안 살 이유가 없죵 그렇게 2번 라이딩을 했는데  카고 빕숏이 진짜 너무 편하더라고요 ㄷㄷㄷㄷㄷ  핸폰을 등에서 안꺼내고 허벅지에서 꺼내는 그 편리함이 ....  팔을 꺽는 움직임이 최소화 되어서 넘 편했슴다 왜 다들 라파 카고 빕숏 노래를 부르고 다니는지 알았숨돠 전 그걸 6분에 1 가격으로 비슷한 제품을 산거니 얼마나 기부니가 좋겟슴까 그런데 말임다 좀 치명적인 단점들이 있김함다  먼저..... 패드위치가 안맞는........ㅋㅋㅋㅋㅋㅋㅋㅋㅋㅋㅋㅋㅋㅋㅋㅋㅋㅋㅋㅋㅋㅋㅋㅋㅋㅋㅋㅋ 보통이면 저기 초록색 원에 맞아야 하는데 빨간색 원쪽에 좌골이 닿아서...  다 타고 나니까 안장통이 스믈스믈ㅋㅋㅋㅋㅋㅋㅋㅋㅋ 왠진 모르게써여..... 저한텐 안맞더라구여  라파, 카스텔리, 아소스, 사일런스 얘내들은 다 잘맞는디......ㅠ.ㅠ. 제 방댕이가 큰건지..... 두번째론...  실밥이 터짐다  이건 아마 원가 절감때매 어쩔수 없는 부분 같은데 왼 라파 카고빕숏 진퉁  /  오른 알리 진퉁  라파껀 봉제선이 내부로 숨겨져 있고 오른쪽 알리 진퉁은 봉제선이 모두 노출이 되어 있슴다 기술이나 원가절감 때문이겠죵? 근데 이게...... 사타구니, 가랭이 부분도 저렇게 노출되어 있어서 안장과 직접 마찰되는 부분인지라 그 부분 실밥이 터지더라거여  자전거 타다가 아랫도리 개방될수 잇는 조심스러움이.... 이래서 진퉁 사는구나...했습니다 물론 가격이 6배 더 비싸지만 말이죵 헌데 여기서 중국 판매자가 더 무서운건 미안하다고 바우처까지 쏴주는... 레알 바우처 쏴주는것도 라파인줄ㅋㅋㅋㅋㅋㅋㅋㅋㅋ 싼 가격에 주머니까지 있어서 너무 마음에 들었지만  저한텐 안맞는 빕숏이라 더 입지는 않을듯 헌디 .. 저 빕숏을 입고 나서 정말 무서움을 느꼈습니다 저 빕숏이 퀄이 올라가고 한국에서 정식 발매 되면서 인플루언서들이 하나둘씩 입는 순간 한국 사이클 의류 업체들은 타격이 크겠구나...라구여 ㄷㄷㄷㄷㄷㄷ 빕숏은 보통 검은색을 많이 입기도 하고 브랜드 티가 잘 안나기 때문에 디자인에 대해 크게 신경안써도 되는건데.. 저 중국산 빕숏은 기능성에 편리성....그리고 저렴한 가격까지 더해지니  무시무시한 병기가 되었더라구여  이태리 패드 납품은 어떻게 뚫은건지...  카고 빕숏 기술은 또 어떻게 기가막히게 따라한건지.. 물론 더 높은 품질과 마케팅으로 승부를 보는곳들은 살아 남을 수 있겠지만 그보다 입문층에서 쉽게 접근 가능한 가격대들은 싹쓸어 갈거 같기도한.. ""가성비""라는 무기로 말이죵 ㄷㄷㄷㄷㄷ 의류쪽이야 뉴욕,파리 패션쇼에서 나오면  1년 뒤엔 동대문에 쫙 깔려서 누구나 쉽게 구매 할 수 있는거긴한데 사이클링 의류들은 시장도 작고 일반 의류들보다 훨씬 비싸니 가격을 생각 안할 수가 없는데 중국 업체들이 물량,단가 싸움으로 그걸 파고 들어버리니 ...ㄷㄷㄷㄷ... 스마트폰도 살아남는게 결국 애플,삼성 그리고 중국업체들이고 우리나라에 들어오는 각종 소형 생활 가전들인 손풍기나 에어프라이기나 등등 이런것들도 거의다 중국 제품 리브랜딩해서 들어오는게 대부분이고......  한국 사이클링 의류 업체도 경쟁 속에 계속 발전해야 살아남을거 같다는 생각이 들었숨돠 빕숏 한번 입고 생각나서 적어봤쑴돠 .....",,2021-09-08 13:41:24,4,,39,"5,424",자전거당,잡담
https://www.clien.net/service/search?q=기가지니,클리앙,"구현모 KT 대표(왼쪽)와 이안 쿠옥 쿠옥그룹 회장(가운데) 등이 지난 8일 온라인 화상회의를 통해 주식매매계약을 체결한 뒤 계약서를 들어보이고 있다. KT 제공 KT가 글로벌데이터 전문기업 엡실론 글로벌커뮤니케이션을 1700억원에 인수했다. 지난해 3월 구현모 KT 대표가 취임한 이후 처음으로 나온 해외 기업 인수합병(M&A) 사례다. KT의 디지털전환(DX) 역량에다 전문기업의 인프라를 더해 2025년 100조원 규모로 커질 전망인 세계 글로벌데이터 시장을 정조준한다는 계획이다. ○엡실론, 런던·뉴욕에 데이터센터 9일 KT는 엡실론 지분 100%를 1억4500만달러(약 1700억원)에 인수하는 주식매매계약(SPA)을 말레이시아 쿠옥그룹과 지난 8일 체결했다고 밝혔다.  (하략)",,2021-09-09 20:50:11,0,,3,"1,541",주식한당,뉴스
https://www.clien.net/service/search?q=기가지니,클리앙,,,2021-08-29 22:39:57,0,,4,"3,211",아이포니앙,잡담
https://www.clien.net/service/search?q=기가지니,클리앙,"집 인터넷+TV를 KT로 바꾸면서 셋톱박스가 기가지니(셋톱박스 + AI스피커) 로 설치되었습니다. 별 생각없이 설치하였고, 기가지니의 AI 스피커 성능은 구글홈이나 기타 다른 AI스피커에 비해서 매우 떨어진다고 들었기에 그쪽은 거의 기대를 안했습니다. 근데 기가지니 앱을 둘러보다가 키즈 서비스 쪽에 ""핑크퐁 칭찬하기"" 이거 완전 개꿀이더군요. 기본적인 아이 정보(이름, 생년월일, 성별)을 입력하면  육아하면서 매일 애랑 투닥거리는 밥 먹기, 양치하기, 손씻기, 정리하기, 잠자기, 목욕하기 같은 명령어를 앱에서 버튼을 누르면 기가 지니가 아이의 이름과 함께 말해줍니다. 예를 들어 밥먹고 양치를 죽어라 싫어하는 아이인데, 기가지니 핑크퐁 칭찬하기에서 양치하기 버튼을 누르면 ""XX(아이 이름)야~ 이를 깨끗이 닦아야 더욱 튼튼해지고 맛있는것도 많이 먹을 수있어요~ 우리 이 닦으러 가자~""  라고 스피커에서 나옵니다.  그리고 아이의 반응에 따라 해당 액션에 대해 ""칭찬하기"", ""타이르기"" 로 긍정, 부정 표현을 할수 있는데 잘 한경우 칭찬하기 누름 ""XX(아이 이름) 야~ 정말 잘했어~ 이를 이렇게 잘 닦으니 정말 반짝반짝하다~"" 뭐 이런식으로 나오고 계속 안가면 타이르기 누르면 ""XX(아이 이름) 야~ 이를 제때 안닦으면 충치균이 쉽게 생겨서 이가 썩을 수 있어요~ 우리 어서 이닦자~"" 뭐 이런식으로 나옵니다. 그리고 ""칭찬 도장"" 이라는 개념이 있어서 잘한것에 대해 기가 지니 안에서 칭찬 도장을 모을 수 도있게 되어있어요. 엄마 아빠 말은 죽어라 안듣는 애가 기가지니가 하는 말은 좀 듣네요. 아이도 부모외에도 피드백을 받는다고 생각하는지 좀 더 본인의 행동에 신경쓰는 느낌입니다. 뜻밖에 개꿀~!",,2021-08-28 12:53:43,4,,5,"3,647",육아당,육아정보
https://www.clien.net/service/search?q=기가지니,클리앙,-ㅤㅤ,,2021-08-17 14:00:19,1,,5,"1,551",모두의공원,
https://www.clien.net/service/search?q=기가지니,클리앙,"아주 건조하게 '야옹' 하네요  ㅋㅋㅋㅋㅋㅋㅋㅋㅋㅋㅋㅋㅋㅋㅋㅋㅋㅋㅋㅋ 그래서 개는 어떤가 싶어 '개'라고 불러봤더니 못 알아들어요 ㅠㅠ 12세, 최, 태 지 맘대로 해석함요",,2021-08-26 22:13:17,0,,3,"2,120",모두의공원,
https://www.clien.net/service/search?q=기가지니,클리앙,,,2021-08-21 06:53:43,33,,21,"12,577",모두의공원,
https://www.clien.net/service/search?q=기가지니,클리앙,69천원 y 데이터 on비디오인가 요금제 씁니당 100기가에 무제한... 데쉐는 2대까지 무료구요. 라우터는 예전에 차량용으로 산 화웨이꺼 8372입니다. h153이라 kt에 유리... 여튼... 그냥 라우터에 껴보니 안됩니다.. 예전에 한번 겪어 본 것 같지만... 당연 kt에 전화해보니 라우터에 개통은 불가능~... 그래서 집에까지 가서 공기계 아이폰8플을 가져오고.. 꼽자마자 데이터 되는거 확인하고... 5분 정도 놔뒀다가 라우터에 꼽았습니다. 그리고 apn 설정을 해주니 됩니다..ㅋㅋ 이럴꺼면 안된다고 하질 말던지.... ㅠㅠ 여러모로 일이 많은 하룹니다... p.s 가운데 줄 간 나의 플립....흑.... 신경쓰이네요 ㅋㅋㅋ,,2021-08-25 17:56:05,0,,23,"2,996",모두의공원,
https://www.clien.net/service/search?q=기가지니,클리앙,"반기가 + TV고 일체의 결합없습니다. 여러 번 연장하면서 오래 썼어요. 10년 훨씬 넘었...(예전에 뭐 썼는지 기억도 없습니다) 마음에 들어서라기보단 귀찮아서...;;;;;;....어지간함 연장하면서 쓰는 스타일입니다. 약정만기는 몇 달 지난 상태고..;;; 방금 생각 나서 전화 넣어보니 30만원 얘기하고...요금은 더 이상 뺄 게 없다고..(월 3만 원 정도 나옵니다...) 지긋지긋한 UHD1 셋톱은 UHD2로 바꿔주겠다, 하고 이런 상태인데... 일단 나중에 연락하겠다,(하니 본인이 하겠다고, 하면서 시간약속하네요) 하고 끊었는데.. 어쩔까 싶네요.  정말 이런 거 안 좋지 않나요?  어떻게 대응하느냐에 따라 가격이 달라지는 거...(이런 거 갖고 머리 복잡해지는 거 싫어서 폰도 자급제+알뜰폰 씁니다) 뭘 어떻게 해도 남보다 손해 보는 기분...ㅠㅠ 대체 이게 무슨 짓인지...모르겠네요.",,2021-08-17 11:55:53,0,,31,"4,162",모두의공원,
https://www.clien.net/service/search?q=기가지니,클리앙,"KT 안드로이드 LTE 라우터 삽질기 (LTE 에그톡, 파파고에그)  부제 : 안드로이드 기반 기기에서 막힌 영역 뚫는 팁 예전에 모공에서 몇번 글 남겼습니다만 좀 더 알아낸 내용 정리해서 사용기에 글 남깁니다. KT에서 2019.07 파파고 에그라 는 기기를 출시합니다. 기본적으로 ""에그"" 입니다 LTE 라우터죠 그렇지만 이 기기는 특이한점을 가지고 있는데요. 바로 안드로이드 7.0 (누가, 7.1.2)을 탑재한 기기라는 점입니다. 모델명은 IML540  인포마크사 제품으로 파파고 에그 에그톡 등으로 불리기도 합니다. 안드로이드 7.1.2 를 탑재한 라우터로 320x240 LCD....는 어쩔수없고 ㅠ 배터리는 3000이라 핫스팟 연속 10시간 가량 사용가능 LTE 밴드 1 3 5 18 19 38 40 41 을 지원하고 1, 3, 5(주력) 1, 3(주력) 1, 5(주력) 적어도 3사 주력 밴드 (sk 5,  KT 3, U+ 5) 지원하면서 동시에 글로벌통용 (1,3) 을 지원하는데 KT에그인 것이지 스마트폰이 아니기때문에 캐리어락을 걸어도 법에 저촉되지 않습니다. 즉 국내에서 KT에그유심 / KT계열 알뜰폰 태블릿요금제유심 이 아니면 사용불가능합니다. 테스트 해본 결과 A. SKT  - SKT 휴대폰심 : Failed (네트워크없음)  - SKT 데함 (스마트폰) : Failed (네트워크없음)  B. KT  - KTM 데함(스마트폰) : Failed (유심오류)   (네트워크 없음 이 아닌 ""USIM 오류"" 라고 뜹니다) C. LG U+  - 이야기 알뜰폰 (태블릿) : Failed (네트워크없음)  3사모듀 오류가 뜨며  KT에그유심 / KT계열 알뜰폰 태블릿요금제 를 제외하곤 유심을 모두 뱉습니다 전화번호는 인식하는 걸로 봐서 캐리어락이 확실하네요 라우터(핫스팟)을 켜서 연결하고 192.168.1.1:8080으로 들어가게되면 KT에그 관리홈페이지에 접속할 수가 있습니다. SKT유심을 꽃은상태인데 지원할 수 없는 카드라고 뜨네요. 
    설정에 - 선결제  sim 이라는 요상한 항목이 있어 찾아보니 외국인을 대상으로한 KT 선불심 이야기더라구요 ------본격적으로 여기부터는 에그를 뚫으려고 노력하면서 알아낸 정보입니다.------  IML540의 경우 기본 핫스팟 비번이 : Info12345 와 같이 정해져있습니다. 기본 비번은 시리얼을 따라갑니다 S/N : 0012345 일때 비번이 Info12345 인 것이죠. 기본 에그 설정 페이지 (WebCM) 은 192.168.1.1:8080이고 192.168.1.1 의 기본 id pw 는 user로 시작하는 다른 에그들과 달리 eggtalk / !InfoEgg12345 (기본비번, s/n이 0012345 인경우) 로 정해져있습니다. 구글링을 통해 알아낸 관리자 설정 페이지는 (  )에 의하면  포트로 관리자모드주소로 진입이 가능합니다. xxx는 시리얼의 마지막 3자리입니다. 즉  S/N : 0012345 일때  인 것이죠. 위 게시글에서는 admin / 1234556 이라고 안내하고있고 제가 시도해본 목록입니다. ID : admin PW :   admin  administrator  0000  000000  12345678  123456  1234  eggtalk  papago  papagoegg  IML540   admin12345 : s/n 을 12345로 가정, 12345 에는 제 시리얼을 넣었습니다. ~ 밑 영역까지 동일합니다.  info12345  0012345  00012345  50345   10345  : s/n 을 12345로 가정, 12345 에는 제 시리얼을 넣었습니다.   infomark  Infomk  InfoEgg  InfomkDev2002! : 2012년도 다른기기 인포마크 관리자 비번  ktEgg  ktegg  ktuser   그 외에 admin 이 아닌 아이디로 시도한 목록은 다음과 같습니다. ktuser / eggtalk ktuser /12345678 eggtalk / admin eggtalk / !InfoEgg12345 (기본비번, s/n이 0012345 인경우)   현재 관리자모드 id/pw 를 모르는 상태인데 일반모드 WebCM에서 기기 라우터설정/유선테더링설정/재부팅/전원끄기 등이 가능 한 것으로 보아 어쩌면 관리자모드 WebCM에서 Adb설정이나, 캐리어락 설정이 가능하지 않을까 생각이 듭니다. 문제는 관리자 모드 비번을 모른다는것 ㅠㅠ 타 에그와 같이 3번틀리면 재부팅해야 암호를 다시 입력할 수 있기 때문에 어차피 리커버리 모드 들어가는김에 시도 해봤습니다. 스샷을 안찍었는데 OEM unlock은 가능합니다만.... recovery.img의 원본이 없고, 제가 루팅이 안된기기에서 recovery.img를 추출할 능력이 되지않아 twrp 제작이 불가능합니다.  (안드로이드는 그냥 깨작깨작 취미로 만집니다..ㅎㅎ) 드라이버는 처음에 안뜨는데 Android fastboot 드라이버라고 쳐서 나오는거 아무거나 깔면 인식됩니다. 홈버튼 처럼 보이는키는 안드로이드에서 ""취소"" 역할을 담당하는 키 입니다. 기기가 꺼져있는 상태에서 전원+취소 버튼을 꾹 누르시고 kt 로고가 뜰 때 전원버튼을 뗐다가 다시 누르면  fastboot mode로 진입가능합니다. cmd로 OEM Unlcok은 가능합니다. 여기서 취소버튼을 누르면 위에 선택창이 바뀌고  파란색 Start Recover (2번째 사진)에서 전원버튼누르면 Android 순정 리커버리 (3번째 사진) 으로 들어갈 수 있습니다 Mount /system : 안먹습니다 리눅스에 물려도 탑재안됨 Adb Side load : 당연히 순정롬 아니면 업데이트 불가... 할 수 있는게 없네요.. View recovery Log 로 알아낸 정보입니다. ro.build.prop의 제품명은 = papagoegg cpu = GDM7243V 이거 좀 찾아봤더니 GDM7243V  : 스마트 IOT 용 칩셋 [GCT세미컨턱터 제작]  - LTE Cat.4  - arm v7a   -기가지니 LTE에 쓰인 물건입니다. 1. T Free Wifi 같은 접속자 인증을 요구하는 Wifi 에 연결을 할면 알림이 뜹니다. - 여기서 저 알림을 클릭하면 웹 미리보기가 뜨고  ipTime 공유기 공지/광고 기능을 통해 제가 원하는 페이지 띄워보았으나  기본브라우저(Webkit)으로 불러오는 화면에서는 파일 다운로드를 지원하지 않습니다. 2. 오른쪽으로 살짝밀면 알림에 대한 설정이 뜹니다. 3. 설정더보기를 누릅니다.   * System UI 튜너 (사진상 빨간네모 롱터치)를 활성화 할 수 있습니다만 접근이 불가합니다. 4. Android 시스템에 대한 설정이 접근됩니다. (다른앱으로 갈 수가 없음 ㅠ)  - 기본 런처는 Simple Launcher 네요  - Ram 10MB 사용중인걸로 막대 비율 계산해보면 약 30배 가량나오는데  - 이로부터 전체 램용량 추정시 약 300mb -> 512mb 탑재 예상됩니다. (20mb 사용중일때도 큰 차이 없는 걸로보아 512mb~1gb 램 아닐까 생각됩니다.) 5. 보면 설정(인포마크)앱과 / 기본설정(안드로이드순정) 앱이 보이는데  설정(인포마크) = 6번 사진의 앱, 기본설정(안드로이드순정)이 순정 설정 으로 보이며  3.) 에서 System UI 튜너 추가가 되도  튜너가 기본설정(안드로이드순정)앱에 추가 될 뿐   내가 접근가능한 설정(인포마크)앱에 안 뜨는 것 같습니다. 6. 설정앱 입니다. 안드로이드 순정설정은 아니고 인포마크에서 따로 만든 설정 앱 인 것 같습니다. 7. 선불 SIM 설정에서 안드로이드 키보드 (G-Board) 소환이 가능합니다 , 키를 오래누르면 8. 처럼 설정이 뜨고 G-Board 설정에 들어갈 수 있습니다.  G-Board 설정에 ""음성입력키"" 활성화를 할 수 있으나, 음성입력은 동작하지 않습니다. 9. 글자 영역을 선택하여 복사/붙여넣기/""공유"" 옵션을 선택할 수 있는데 10. 공유옵션 선택시 아무 앱도 뜨지 않습니다. WiFi-Direct : 설정에 살아는 있는데 동작하지않습니다 인증서불러오기 : 순정브라우저가 뜨긴하는데 할 수 있는게 없습니다, 파일조차 뜨지 않아요.  - 블루투스 키보드 연결 불가  - USB 키보드 연결 불가. - 심지어 공홈에서 제공하는 순정 펌웨어도 없습니다 - 만지다 벽돌되면 유상 A/S 직행 제가 이전에 쓴 RS350 (안드로이드 탑재 블루투스 스피커) 같은경우 USB 키보드가 있어서 정말 수월하게 뚫었었습니다.  - 참고 :  이 IML 540 같은경우 일반인(?) 수준에선 뚫기 어렵게 잘 막아뒀네요 지금 중고가가 3-5만원 정도 하는데. 결국 이 KT 파파고 에그 (IML540)의 효용은 캐리어락이 없을 때 추천할 만하다 하겠습니다. 물론 이론상 안드로이드니깐 실력이 좋으신분은 푸실 수 도 있겠지요? 그런데 CPU가 GDM7243V 이고 이게 LTE포함 원칩인거 같은데  GDM7243 기반 디바이스 중에 언락된 기기의 modem.img가 필요한데... 글쎄요 제가 아는건 기가지니LTE에 탑재된건데.. 이정도면 보나마나 (쟤도 안드로이드 기반인지 모르겠지만) 캐리어락이.... 결론은 캐리어락은 못 푼다 보시면됩니다. 지금 까지 성공한 기기는 제가 알기로는 LG G / G2 / G3 계열 기기들 modem.img 덮어쓰기 샤오미 기기들 / 픽셀기기들 VoLTE를 위해서 modem.img 수정인데  결국 언락폰의 원본 img가 있는 거니깐요  그렇다면 KT에그로 쓰실 분께는 추천할 만 하냐 .. 3-5만원이면 그래도 쓸만합니다 KT주파수 잘 지원하고, 화웨이라우터가 알리익스프레스던 중고던 3-4만원 선인데 화웨이 찜찜하신 분께는 국산 라우터가 좋죠 다만 8만원? 그정도 가격이면 사지마세요 ADB도 안되고 앱설치도 안되는 안드로이드 스킨을 쓴 에그 로 사기엔 8만원은 아까운 것 같습니다. 4-5만원 이하가격에서는 적극 추천드립니다.  그 이유는 화면의 효용성 때문입니다. 2.4"" 화면이 작긴 하지만 에그에선 충분히 큰화면입니다 다른 에그들과 달리 에그자체에서 비밀번호 설정 / 5G/2.4Ghz 설정 / SSID 바꾸기 / 에그 배터리 확인 / 핫스팟 종료 등등을 Web CM 을 거치지 않고 가능하거든요 이건 분명한 장점이고, 타 에그들보다 돈을 더주고 구매할 가치가 있다고 봅니다. KT일반유심만 사용가능했어도... 더 좋았을텐데 KT에그전용유심이나 / 태블릿 유심만 가능한게 매우 아쉽습니다. 아 파파고...물어보시는 분들이 계신데 애초에 저는 파파고 생각은 하지도 않았고 파파고 기본앱에서 실시간 번역은 WiFi or DATA 연결이 되어야 사용가능하기때문에 리뷰하지 않습니다. (기본 내장 회화예문앱은 인터넷 연결없이 사용가능) 다음에는 국산 5G   라우터 후기로 찾아뵙겠습니다. 1. 캐리어락 걸려있어요 (KT에그유심/KTM태블릿요금제유심(데쉐불가)만가능) 2. WebCM을 거치지 않고 기기내에서 여러 세팅이 가능합니다. : 분명한 장점 3. 5만원 근처에서 국산 라우터를 원하신다면 추천드립니다. (단.. KT에그유심만..가능.)  ",,2021-08-21 18:47:06,5,,16,"14,121",사용기,전자기기
https://www.clien.net/service/search?q=기가지니,클리앙,  참치 가득 넣고 김치찌개 끓여 한잔 합니다 여름엔 날이 더워 찌개나 탕 종류는 안 만들었었는데 이제 좀 선선해지니 요리 할만 하네요~ 업소용 참치 사다 참치 듬뿍 넣으니   맛이 기가 막힙니다 ㅎㅎㅎ,,2021-08-23 11:11:56,6,,12,"2,972",모두의공원,
